,name,income,expend
84924,The Guildford Chamber Choir,7882.0,9289.0
135707,The Artfully Reliable Theatre Society (2013),7881.0,1376.0
85079,The Friends of the Georgian Society of Jamaica,7880.0,5736.0
61792,The Betty Wivell Academy Trust,7876.0,11788.0
57160,Lions Club of Rugeley Trust Fund,7865.0,7522.0
75704,Tonbridge Round Table Charitable Trust,7859.0,3394.0
21137,Waveney Sinfonia Musical Society,7854.0,5602.0
103855,Oakfield Choir,7854.0,9244.0
86269,The Rotary Club of Sedgley and Wombourne,7851.0,7696.0
42199,Cymdeithas Hanes Teuluoedd Powys/Powys Family History Society,7850.0,6755.0
74347,Kingston Grammar School Music Society,7848.0,2752.0
20108,Friends of the Museum of Bath at Work,7847.0,7433.0
28618,The Reading Guild of Artists,7846.0,5868.0
105254,The Laurence Singers,7842.0,7122.0
27649,The Rotary Club of Abingdon Trust Fund,7841.0,4776.0
120390,Basil Howard Trust,7837.0,6562.0
40691,Association of Friends of the Royal Welsh College of Music and Drama,7835.0,4380.0
129858,Trans Media Watch,7834.0,5357.0
98221,East Bedfordshire Concert Band,7832.0,9625.0
21615,"Recreation Ground, Durley, Hants",7832.0,14707.0
57836,Askam Town Silver Band,7832.0,5655.0
134726,The Triorca Trust,7831.0,3256.0
114729,Narborough Cricket Club,7828.0,8282.0
