,name,income,expend
115514,Totnes Saturday Music School,19475.0,13745.0
34970,Polehampton Swimming Association,19474.0,13753.0
82626,The Wayne Sleep Foundation,19457.0,19205.0
78345,Rotary Club of Swaffham,19451.0,17856.0
27764,Kenton Victory Hall,19439.0,14553.0
86202,Rotary Club of Stockport Lamplighter Trust Fund,19438.0,15928.0
70435,Swansea Philharmonic Choir,19434.0,28093.0
58735,Tipton St John Playing Field Association,19427.0,7469.0
116069,Timeline,19426.0,36090.0
39744,Cor Meibion Maesteg A'r Cylch (Maesteg and District Male Voice Choir),19426.0,20600.0
116804,Centenary Drama Group and C.D Kids,19424.0,11360.0
36747,The Hellenic Foundation,19421.0,14113.0
15923,Alton Operatic and Dramatic Society,19420.0,18780.0
83685,The Tyneside Locomotive Museum Trust Limited,19417.0,9772.0
95064,Gwrych Castle Preservation Trust Limited,19408.0,12286.0
61014,Rotary Club of Faringdon and District Trust Fund,19407.0,18484.0
6624,The Athenaeum,19406.0,16309.0
22625,The North Devon Choral Society,19404.0,17368.0
134851,Coactive Arts,19400.0,20822.0
124567,Kresy-Siberia (Uk),19397.0,21141.0
88781,Rotary Club of Oadby Charitable Trust,19396.0,20946.0
116087,Pimlott Foundation,19394.0,9450.0
56095,Louth Choral Society,19385.0,31126.0
26869,Middlesex Colts Association,19376.0,20411.0
70653,Sacred Arts Trust,19358.0,33672.0
111664,The Rotary Club of Bracknell Three Counties Trust Fund,19352.0,16793.0
80254,Portsmouth Junior Rugby Football Club,19350.0,0.0
70659,Isle of Wight Cantata Choir,19346.0,19209.0
51939,Hook Choral Society,19342.0,25601.0
65608,Rotary Club of Torrington Trust Fund,19340.0,17414.0
13646,Reading Festival Chorus,19339.0,16802.0
61586,Rotary Club of Hereford Trust Fund,19335.0,20078.0
19613,The Tamaritans Theatre Company,19335.0,15961.0
68451,Rotary Club of Crewkerne Trust Fund,19331.0,21770.0
80716,Millom Folk Museum Society,19326.0,24307.0
40396,Bollington Light Opera Group,19322.0,14080.0
73757,British Amputee and Les Autres Sports Association,19319.0,23483.0
95024,The Hatch-Barnwell Charitable Trust,19318.0,10201.0
29168,Hampshire County Youth Band Association,19315.0,16642.0
77778,The Orlando Chamber Choir,19312.0,17705.0
123701,Bois Goetre-Hen A'r Cylch,19302.0,16293.0
74065,St Albans Museums and Galleries Trust,19299.0,13942.0
120433,Rossendale Amateur Operatic Society,19295.0,18449.0
114951,Seaham Harbour Cricket Club,19294.0,18624.0
121223,Royal Marines Band Portsmouth,19293.0,27630.0
42333,The Moseley Society,19290.0,18296.0
41206,Long Eaton Militaires Carnival Band,19283.0,22523.0
91541,Sandhurst Silver Band,19274.0,18467.0
111290,The Richard Carne Trust,19266.0,186347.0
76484,British Wheelchair Bowls Association,19265.0,15786.0
77923,The Phoenix Players (Portsmouth),19264.0,18755.0
15717,The Weymouth Operatic Society,19260.0,23761.0
32764,Great Ellingham Recreation Ground and Centre,19256.0,14508.0
92454,BR. E. A. C. C. - Brazilian Educational and Cultural Centre,19255.0,14512.0
59122,The Romford Lions Club Charity Trust Fund,19253.0,14664.0
63706,Rotary Club of Bideford Bridge Trust Fund,19248.0,19335.0
72082,Gosport Living History Society,19245.0,14644.0
54188,St Ives (Cornwall) Arts Club Society,19244.0,18305.0
18386,Gravesend Rotary Club Service Fund,19235.0,18516.0
61244,East Cornwall Bach Choir,19211.0,18124.0
130767,New Era Players,19211.0,13122.0
35553,The Writtle Library and Reading Room,19202.0,18002.0
71892,The Rotary Club of Carlton Trust Fund,19199.0,21792.0
38363,Sale Choral Society,19197.0,19010.0
47148,Norton-in-the-Moors Miners Welfare Recreation Ground and Institute,19186.0,19890.0
76081,Kadam Asian Dance and Music Limited,19185.0,25645.0
64449,Rotary Club of the Channel Trust Fund,19184.0,22178.0
23565,The Charitable Fund of the Rotary Club of Portsmouth and Southsea,19184.0,23077.0
43045,The Bentley Operatic Society,19173.0,21272.0
132355,International Friends of the International Lyric Art Festival,19156.0,1246.0
23728,The Woking Amateur Operatic Society,19155.0,20177.0
103062,Cannock Chase Orpheus Male Choir,19155.0,19509.0
88026,Lincoln Minster Round Table Charitable Trust Fund,19154.0,14186.0
67796,Rotary Club of Reepham and District Trust Fund,19153.0,19434.0
51715,The Taunton Thespians,19151.0,21386.0
123405,The Bournemouth & East Dorset Barbershop Harmony Club,19150.0,14098.0
122910,Forward Thinking with Football,19139.0,19468.0
65809,Malmesbury Abbey Music Society,19137.0,19122.0
74086,Howdenshire Live Arts,19133.0,15502.0
14724,The Brother Jonathan Trust for Children's Holidays,19130.0,24780.0
132417,The Quay Players,19117.0,13358.0
40072,Hull and East Riding Antiques and Fine Arts Society,19109.0,19391.0
19840,Aylesbury Choral Society,19108.0,18497.0
59281,Chester Bach Singers,19104.0,19862.0
43308,Rugby Rokeby Lions Club Charity Trust Fund,19091.0,21802.0
68305,The Rotary Club of Truro,19090.0,19342.0
21621,Ipswich Choral Society,19083.0,22225.0
44373,Crewe Amateur Musicals Society,19079.0,28420.0
29950,Stimpson's Piece,19078.0,23581.0
73304,Rotary Club of Bassenthwaite Trust Fund,19076.0,21144.0
45094,The Concord Drum and Bugle Corps,19073.0,16977.0
39894,Burry Port Opera,19062.0,20409.0
124335,The Rugby Fives Association,19060.0,17042.0
110684,Amaka Beautiful Child,19050.0,19022.0
56006,Peterborough Choral Society,19045.0,16119.0
123912,The Sampson Orchestra of Cambridge,19043.0,19020.0
61854,Hanborough and District Day Centre,19042.0,19181.0
132732,Nunsmoor Centre Trust,19037.0,24256.0
112870,Headingley Lishi Arts,19030.0,17243.0
50572,Chester Orchestral Society,19022.0,21477.0
58244,Deanery Players,19008.0,19406.0
43802,The Stalybridge Old Band,19007.0,20065.0
44945,Kingswinford and Stourbridge Lions Club Charity Trust Fund,19006.0,19746.0
66028,The Rotary Club of Yate and District Foundation Trust Fund,19000.0,22437.0
111340,Fluxus Art Projects,18998.0,7585.0
24536,March and District Museum Society,18991.0,17464.0
60181,The Rotary Club of Brookmans Park Trust Fund,18990.0,24288.0
102691,Cross Street Arts,18986.0,14941.0
56339,Lutterworth Museum Trust,18967.0,18967.0
34374,The Eastbourne Arts Circle,18960.0,16596.0
17189,The Petersfield Orchestra,18959.0,17692.0
121551,Lytham Amateur Operatic Society,18955.0,16662.0
64256,"Rotary Club of Stanford & Corringham, Charity Trust Fund",18951.0,15946.0
45105,New Harmony Singers,18939.0,12113.0
21748,Beccles and District Museum,18937.0,19104.0
43796,Nottinghamshire Family History Society,18937.0,18175.0
13319,Dudley Little Theatre,18930.0,17058.0
96252,Stoke Row Sports and Leisure Club Limited,18928.0,23919.0
28692,The K Blundell Trust,18927.0,21027.0
52721,Harrow School for Young Musicians Parents' Guild,18917.0,14265.0
72573,Mountain Ash and District Choral Society,18911.0,20912.0
69774,Hereford Lions Club Charity Trust Fund,18905.0,18862.0
53867,"King George's Field, Canvey Island",18898.0,18898.0
23056,Swanage Lions Club Charity Trust Fund,18892.0,17783.0
32801,Martham Coronation Recreation Ground,18878.0,11292.0
38332,Cleckheaton and Spenborough Amateur Operatic and Dramatic Society,18851.0,16783.0
58786,Furness and South Cumbria Wheelchair Sports Club,18848.0,6850.0
137019,Macclesfield Community Artspace,18842.0,15174.0
130973,Dacorum Community Choir,18839.0,9382.0
42641,The Rotary Club of Preston South Trust Fund,18835.0,15357.0
79996,Rotary Club of Blaby Trust Fund,18835.0,7315.0
38050,Royden Hall,18831.0,19286.0
38409,The Leicester Bach Choir,18830.0,16633.0
40698,Grindleford Playing Field Trust,18815.0,16101.0
95542,The Sir Stanley Matthews Foundation,18815.0,23413.0
40136,Newport Pantomime and Musical Society,18808.0,15970.0
106929,Bicester Choral and Operatic Society,18805.0,28608.0
52194,Bournemouth Male Voice Choir,18802.0,15471.0
134509,The Brian Shaw Memorial Trust,18799.0,14675.0
25219,Cornwall Music Festival,18794.0,15282.0
22313,Stowmarket Chorale,18792.0,22479.0
118839,Froxfield Choir,18790.0,14457.0
60967,Aquarius Womens Club,18783.0,17179.0
120273,The Massive Project (Essex),18782.0,18692.0
129381,Cadishead Public Band,18780.0,23634.0
44609,British Art and Design Association,18780.0,21593.0
95314,Horsley Choral Society,18778.0,15261.0
83770,Haverfordwest Town Museum,18776.0,16278.0
69932,Calne Lions Club Charity Trust Fund,18768.0,11754.0
26605,Newbury Choral Society,18759.0,13349.0
43985,The Aberdovey Literary Institute,18759.0,18325.0
17081,Attic Theatre Limited,18758.0,17543.0
81772,Mortehoe Heritage Trust,18750.0,20685.0
26885,Hatton Musical Theatre Society,18744.0,22827.0
69980,Chermond,18736.0,18736.0
71473,Biddulph Male Voice Choir,18732.0,16446.0
38194,Rotary Club of Ulverston Trust Fund,18710.0,19988.0
42218,Cor Meibion Caernarfon,18702.0,19172.0
112661,Wimbledon Film Club,18701.0,22908.0
61743,Rotary Club of Malton and Norton Trust Fund,18696.0,14795.0
72990,Rotary Club of Northampton West Charity Fund,18690.0,13231.0
37985,Radio Tyneside - the Tyneside Hospitals Broadcasting Service,18687.0,12529.0
57635,Vitus Ltd,18682.0,17901.0
93986,Penderyn Sports and Social Association,18669.0,14900.0
78999,Welsh Sailing Venture,18662.0,11858.0
130384,Trinity Concert Band,18660.0,12627.0
66098,The Rotary Club of Whitchurch Trust Fund,18652.0,16818.0
108604,Torpoint Bowling Club,18652.0,16895.0
78538,The Royal Scottish Country Dance Society Ribble Valley Branch,18648.0,20587.0
114166,The Market Hall Trust,18644.0,13545.0
39214,Scunthorpe and District Choral Society,18623.0,24612.0
27969,The Tads Theatre Group,18619.0,17755.0
78230,Rotary Club of Aberystwyth Charity Trust Fund,18619.0,24483.0
19512,Fareham Philharmonic Society,18607.0,17029.0
40563,St Paul's Operatic Society,18603.0,10840.0
13759,The Welwyn Thalians,18601.0,16761.0
76791,King's Lynn Operatic and Dramatic Society,18600.0,17836.0
27456,Bournemouth Carnival Band,18598.0,21027.0
19612,Aylesbury Hospital Radio,18594.0,9615.0
136587,Gemini PCC Abc,18591.0,9238.0
121777,Kerala Cultural and Welfare Association (Kcwa),18588.0,17489.0
38515,Port Talbot and District Amateur Operatic Society,18583.0,23891.0
78767,The Royal Scottish Country Dance Society Newcastle Upon Tyne and District Branch,18575.0,17977.0
33568,Cock Lane Recreation Ground,18574.0,18574.0
62047,St Neots Choral Society,18573.0,17126.0
27902,The Playing Field,18573.0,29310.0
81300,"Royal Scottish Country Dance Society, York and North Humberside Branch",18567.0,18582.0
85173,Disability Gymnastics - London,18565.0,16364.0
69337,Save Europe's Heritage,18560.0,3052.0
67283,The Rotary Club of the South Cotswolds Trust Fund,18560.0,10097.0
33958,Seend Lye Recreation Field,18553.0,34318.0
19475,Pitstone and Ivinghoe Museum Society,18551.0,11952.0
18533,Adur Recreation Ground,18547.0,15076.0
95990,The Saint James' Singers,18546.0,17879.0
120610,The George Morgan Young Player Trust,18544.0,13417.0
2262,Great Bardfield Charities,18542.0,16180.0
43681,The Rawcliffe Recreation Association,18542.0,53959.0
52840,Godalming Music Festival,18531.0,21304.0
73586,Mill Hill Music Club,18525.0,17420.0
95749,Cirencester Round Table Number 286,18523.0,19585.0
133643,The Luke Somerfield Memorial Trust,18520.0,1158.0
59156,Rotary Club of Hornchurch and Upminster Trust Fund,18514.0,16629.0
133896,Colchester Chamber Choir,18514.0,14411.0
119234,Chess Valley University of the Third Age,18513.0,12076.0
40640,Spilsby Recreation Ground,18512.0,16103.0
52023,Somerset Building Preservation Trust Company Limited,18508.0,842036.0
95636,North of England Historic Railway Trust Limited,18493.0,15985.0
29842,Cambridge Antiquarian Society,18480.0,16116.0
132109,The Julie Cowans Memorial Trust,18477.0,1100.0
119725,Isleworth Baroque,18472.0,14191.0
113215,Llangynwyd Rangers Boys' and Girls' Club of Wales Football Club,18466.0,20247.0
127142,The Shaw Lane Foundation,18451.0,7696.0
134375,The Rotary Club of Croydon Whitgift Trust Fund,18450.0,9972.0
82091,Diamond Dance Limited,18445.0,23032.0
108608,The Wirral Symphony Orchestra,18443.0,18233.0
132003,Whitefield Amateur Operatic & Dramatic Society,18442.0,15113.0
30587,Grampound with Creed War Memorial Recreation Ground and Public Hall,18433.0,18679.0
97693,The Wickham Market Partnership,18432.0,22452.0
128267,Warley Rangers Junior Football Club,18427.0,17624.0
57576,The Rotary Club of Walton on Thames Trust Fund,18410.0,28496.0
31569,War Memorial Recreation Ground,18404.0,40771.0
114322,Swindon Male Voice Choir,18404.0,20180.0
130972,The Faction Theatre Productions Ltd,18400.0,16560.0
130286,Sarah's Rural Library Fund,18396.0,6518.0
24443,Dorchester Choral Society,18391.0,27149.0
66586,The Rotary Club of Kew Gardens Charity Projects Trust Fund,18387.0,13175.0
108026,Solihull Chandos Choir,18382.0,16259.0
66065,The Rotary Club of Thornbury Trust Fund,18379.0,18422.0
17847,Ruardean Memorial Hall and Playing Fields,18376.0,14656.0
64898,Rotary Club of Chesterfield Trust Fund,18374.0,16372.0
39361,Trevethin and Penygarn Neighbourhood Association,18372.0,15198.0
136994,Yorkshire and Humberside Federation of Museums and Galleries,18370.0,26074.0
99936,Sheep Music Ltd,18359.0,24926.0
64820,Rotary Club of Kibworth and Fleckney Trust Fund,18359.0,18192.0
16634,The Bramley Village Society,18357.0,16956.0
22959,The Society of Jewellery Historians,18352.0,31355.0
24616,Braintree District Arts Voluntary Association,18348.0,21621.0
99291,West Bowling People's Partnership,18345.0,29535.0
99214,Walton Street Community and Leisure Association,18340.0,19852.0
22509,The Ashridge Decorative and Fine Arts Society,18336.0,17277.0
94114,Treverva Male Voice Choir,18326.0,18902.0
3046,Regency Society of Brighton and Hove,18326.0,11826.0
65391,Oriental Arts (Bradford) Limited,18325.0,18158.0
27900,West of England Bandsmen's Festival,18324.0,16663.0
118029,Wales Deaf Golf Association,18321.0,15699.0
98183,Hampton Community and Sports Association,18314.0,31308.0
42184,Bromsgrove Operatic Society,18308.0,18539.0
15629,Rotary Club of Twickenham Trust Fund,18308.0,30378.0
124585,Thornhill United Football Club,18304.0,12021.0
121664,The Bristol Phoenix Choir,18300.0,16614.0
66928,Rotary Club of Bodmin Trust Fund,18299.0,23936.0
117197,Rotary Club of Nailsworth Trust Fund,18292.0,5521.0
16083,The Pipe Roll Society,18291.0,953.0
67513,Rotary Club of Ashton-Under-Lyne Trust Fund,18285.0,18443.0
136339,Wrightington Hall - Charnley Education and Heritage Centre,18279.0,18279.0
106259,Cambridge Chorale,18273.0,18503.0
44753,Todmorden Lions Club Charity Trust Fund,18273.0,16476.0
43998,Airedale Symphony Orchestra,18267.0,19931.0
110437,The Vic 96 Trust,18264.0,11621.0
19377,Northfleet & Ebbsfleet Lions Club Charity Trust Fund,18255.0,19124.0
65479,Reigate & Redhill Music and Drama Festival,18253.0,20092.0
123827,The Charlie Lamb Charity,18252.0,12919.0
62838,Rotary Club of Wootton Bassett and District Trust Fund,18247.0,19415.0
33261,Recreation Ground,18247.0,32595.0
28217,Woking Symphony Orchestra,18243.0,16159.0
42822,West Hallam Centre and Recreation Ground,18228.0,22876.0
12934,Charity Fund of the Rotary Club of Leigh-on-Sea,18223.0,11435.0
15225,The Crafts Study Centre,18216.0,37740.0
86904,The Acorn Music Theatre Trust,18216.0,19357.0
59507,Blackmore Vale Lions Club Charity Trust Fund,18215.0,23430.0
120030,The Biographers Club Limited,18211.0,15564.0
18534,Lewisham Toy Library,18207.0,15125.0
27928,Midsummer Opera,18201.0,17394.0
74181,London Schools Athletic Association,18200.0,17300.0
74928,Herne Bay Musical Theatre Society,18188.0,21191.0
63103,The Rotary Club of Catford Charitable Trust,18180.0,19901.0
22860,Poole Lions Club Charity Trust Fund,18179.0,12576.0
135774,Friends of Tynemouth Outdoor Pool,18177.0,10727.0
74708,Gravesham Sports Trust,18167.0,10739.0
88804,Winterton and District Lions Club Charitable Trust Fund,18166.0,19221.0
64195,Rotary Club of Lutterworth Trust Fund,18164.0,19759.0
33001,Nine Acres Recreation Ground,18135.0,14272.0
120855,Solomon's Knot Productions Limited,18132.0,24812.0
92743,Sale Nomads Theatre Club,18129.0,22565.0
108507,Greyladyes Arts Foundation,18128.0,15965.0
15705,The London Archaeologist Association,18124.0,13960.0
112943,Hull Chamber Music Society,18118.0,15860.0
55035,Fishburn Band,18118.0,17321.0
55217,Furness Lions Club Charity Trust Fund,18115.0,14661.0
110107,The Liverpool Academy of Arts,18114.0,15126.0
48249,The Haverfordwest Public Swimming Pool,18105.0,13657.0
74265,Durham Miners' Association Brass Band,18097.0,15669.0
89005,Rainbow Film Society,18095.0,14473.0
40132,The Leeds Symphony Orchestra,18094.0,14249.0
51153,Cavendish Decorative and Fine Arts Society,18082.0,18570.0
103481,St Kitts-Nevis Association (Slough),18068.0,14726.0
121252,Diversity Choir,18066.0,19138.0
92643,Addington Afro-Ethnic Health Promotion Group,18064.0,17964.0
21636,Colchester Choral Society,18064.0,20282.0
77266,Bookham Choral Society,18061.0,15359.0
79016,Rotary Club of Ashburton and Buckfastleigh Trust Fund,18058.0,22415.0
89283,Isle of Axholme Lions Club Charitable Trust Fund,18057.0,14663.0
109405,Manor Road Gym Sports Club,18050.0,18500.0
53146,Lydia Eva and Mincarlo Charitable Trust Limited,18037.0,26987.0
133273,The White Review,18035.0,18153.0
29016,Dutch Pot Lunch and Social Club,18031.0,16283.0
98077,The Rotary Club of Royal Wootton Bassett Town Trust Fund,18022.0,23277.0
81892,The W H Smith Archive,18018.0,18035.0
19934,Berkhamsted Music Society,18015.0,17470.0
92154,The Rugby Fives Association Charitable Trust,18009.0,10516.0
127792,The Bishopsteignton Museum Charitable Trust,18008.0,14376.0
117013,Grayshott Cricket Club,18006.0,18735.0
105896,City of Manchester Opera,18000.0,12000.0
135519,Notting Hill Carnival Festivals Trust,18000.0,18000.0
134072,Yoruba Arts Trust,18000.0,17990.0
13025,Friends of Bolton Museum and Art Gallery,17999.0,16424.0
73937,Sitlington and District Round Table Number 1088 Charitable Trust Fund,17996.0,17642.0
44781,The Theatre Royal (ST Helens) Trust,17991.0,80151.0
46167,King George's Field,17981.0,242911.0
33033,Recreation Ground Charity,17981.0,15779.0
68553,Rotary Club of Market Rasen Trust Fund,17980.0,16770.0
47546,The Wheldrake Recreation Ground Foundation,17977.0,24901.0
64147,Hatfield Rotary Club Trust Fund,17976.0,17857.0
71331,National Association of Youth Theatres,17974.0,24173.0
104862,Orbit Shed,17972.0,10264.0
107248,Crowthorne Symphony Orchestra,17971.0,14905.0
76660,Stanhope Silver Prize Band,17964.0,10900.0
82052,Friends of Scarborough Art Gallery,17955.0,17630.0
66428,Cae Glas Charity,17950.0,18089.0
118632,The Thoresby Society,17934.0,18696.0
131185,The Sussex Harmonisers,17934.0,18316.0
105264,Wendover Choral Society,17934.0,18275.0
125893,Beckenham Ladies Choir,17933.0,16868.0
53513,The Rotary Club of Reading Abbey Trust Fund,17930.0,18079.0
129618,Kerala Arts and Literary Association (Kala),17923.0,18868.0
42226,Frodsham and District Choral Society,17920.0,15385.0
31625,Crofton Recreation Ground,17912.0,17912.0
119957,Harrow Harmony,17910.0,17522.0
41466,Warwick Lions Club Charity Trust Fund,17905.0,20035.0
62206,St Luke's Club Overton,17904.0,11918.0
12163,Federation of Old Cornwall Societies,17902.0,11031.0
112436,Lakes Gospel Choir,17901.0,20448.0
32739,Castleacre Playing Field,17893.0,7471.0
122983,The Jamie G Sporting Trust,17888.0,10396.0
112101,Wymondham Judo Club,17887.0,14357.0
76711,GWRT Charitable Trust,17881.0,23825.0
112375,Friends of Somerset Young Carers Project,17877.0,17716.0
128256,The Crosby Orchestral Society,17871.0,17098.0
61881,Rotary Club of Wilton Trust Fund,17839.0,18264.0
43490,York Symphony Orchestra,17831.0,15164.0
38715,Rufforth Playing Fields Association,17823.0,14467.0
72624,The Henleaze Concert Society,17796.0,17775.0
111843,The Stamford Gilbert and Sullivan Players,17781.0,13378.0
53592,Exmoor Singers,17781.0,20611.0
42039,Ludlow Choral Society,17780.0,13406.0
47537,Stamford Bridge and District Playing Fields Association,17776.0,23786.0
78391,Theatre Melange,17770.0,39360.0
53542,Axminster and District Choral Society,17760.0,22481.0
131717,The Forest Musical Society,17752.0,17386.0
28047,Masque Theatre,17751.0,20305.0
51752,The Rotary Club of Plymouth Trust Fund,17751.0,18060.0
111721,Northampton Fencing Club,17748.0,15220.0
90447,The Stanborough Chorus,17746.0,15889.0
5167,Flintshire Historical Society,17742.0,15373.0
72691,The New Mechanics Institution Preservation Trust Limited,17742.0,24547.0
99301,Boxford Masques,17719.0,39448.0
76836,The Chester Ladies Choir,17718.0,26058.0
78016,Full Potential Arts,17714.0,1601.0
132420,The Friends of Summertown Library,17700.0,4828.0
106348,Oswestry Musical Theatre Company,17700.0,19258.0
112458,Rotary Club of Great Missenden Trust Fund,17696.0,17960.0
85721,The John Merricks Sailing Trust,17696.0,58362.0
27681,West Norfolk Gilbert and Sullivan Operatic Society,17689.0,22648.0
18874,Jewellery and Silver Society of Oxford,17687.0,20487.0
65770,Rotary Club of Appleby Trust Fund,17687.0,16753.0
91469,Teignmouth Jazz,17677.0,20471.0
121966,Old Sharlston Cricket Club,17676.0,15552.0
26112,The Friends of Coldharbour Mill Museum,17673.0,16485.0
131458,The New Music Makers,17673.0,16762.0
91251,The Richard Ely Trust for Young Musicians,17670.0,12070.0
116347,The Brook Street Band Trust,17666.0,5645.0
43112,The Rotary Club of Saddleworth Trust Fund,17662.0,15881.0
35255,The Street Library,17654.0,4958.0
38880,Bromsgrove Rotary Club Charitable Trust,17653.0,7000.0
39045,Leeds Arts Centre,17651.0,18064.0
76236,Drip Action Theatre Company,17650.0,16725.0
60890,Winkleigh War Memorial Recreation Field,17644.0,14565.0
33699,Framfield Memorial Hall and Recreation Ground,17636.0,14145.0
68641,The Rotary Club of Romsey Trust Fund,17618.0,9558.0
131547,Bossingham Sports and Leisure Trust,17615.0,7450.0
31524,Goodworth Clatford Village Club,17609.0,17699.0
131595,The Kodaly Society of Wales,17606.0,19163.0
109349,The Wallpaper History Society,17600.0,6953.0
82483,The Diggle Band,17598.0,19418.0
56758,Levens Choir,17597.0,16120.0
60004,Wallingford Chameleon Arts,17593.0,15368.0
62983,The London Symphony Chorus Endowment Fund,17583.0,26085.0
99016,Torbay Symphony Orchestra,17582.0,19289.0
82308,The Feneley Library Trust,17579.0,143.0
66700,Melodians Steel Orchestra ( UK ),17572.0,14032.0
22747,Aeolian Singers (Hemel Hempstead),17571.0,17157.0
76422,Gilbert Bayes Charitable Trust,17565.0,33781.0
104206,Stanley Opera,17561.0,21076.0
105139,Wetherby Arts Festival,17561.0,21797.0
131702,Litherland Tigers Junior Football Club,17551.0,12311.0
42581,Cymdeithas Hanes Teuluoedd Gwynedd/Gwynedd Family History Society,17545.0,18626.0
41403,Haverfordwest Racecourse (Public Park) Trust,17539.0,11409.0
125796,Kitov Limited,17537.0,16784.0
43132,The Dore Male Voice Choir,17537.0,14230.0
77954,Mno Club,17530.0,17169.0
123585,Londinium,17529.0,18229.0
73361,The Rotary Club of Rayleigh Mill Trust Fund,17519.0,8863.0
90969,The Dawdon Recreational Ground,17514.0,10471.0
131142,Imos Foundation,17500.0,12949.0
46364,Sapcote Recreation Ground,17498.0,16633.0
75138,Occam Singers,17492.0,14708.0
105826,The Solent Decorative and Fine Arts Society,17490.0,20028.0
104163,British-Arab Exchanges,17484.0,19168.0
12116,The Bishop's Stortford Choral Society,17473.0,18301.0
126033,Brandon Football Club,17472.0,22266.0
25223,The Wilton and District Youth Band,17472.0,18753.0
78662,Wedmore Opera Limited,17467.0,6803.0
40398,Melton Mowbray Lions Club Welfare Account,17467.0,19647.0
76965,Harpenden Lions Club Charitable Trust Fund,17467.0,18460.0
100400,Hailsham Choral Society,17455.0,20044.0
64087,Rotary Club of St Albans Trust Fund,17440.0,20440.0
978,The Stroud Choral Society,17437.0,11322.0
23873,The Society for International Folk Dancing,17418.0,11682.0
32756,Playing Field and Recreation Ground,17417.0,21250.0
72980,Dorset Youth Marching Band,17412.0,16837.0
134432,Leeds Swahili Cultural Community,17412.0,5938.0
20787,The Museum of the Royal Army Chaplains' Department,17410.0,14064.0
60172,Rotary Club of Cheltenham North Trust Fund,17408.0,17615.0
65172,The Rotary Club of Harwich and Dovercourt Charity Trust,17406.0,17318.0
22269,Wiltshire Buildings Record,17406.0,15542.0
34469,Allhallows Museum Society of Honiton,17405.0,12951.0
124069,Sherborne Community Arts Centre Trust,17401.0,25757.0
67511,Rotary Club of Ambleside Trust Fund,17400.0,12199.0
116621,Poole Flying Boats Celebration Limited,17398.0,12541.0
68794,The Mansfield and District Male Voice Choir,17394.0,15807.0
58058,Sidmouth Lions Club Charity Trust Fund,17389.0,18875.0
125349,Yetga Theatre School,17384.0,18333.0
67741,Rotary Club of Oxford Isis Trust Fund,17379.0,15906.0
75487,Braithwell and Micklebring Recreation and Leisure Association,17363.0,15982.0
119369,National Blind Tenpin Bowling Association,17362.0,10429.0
77381,Wensleydale Round Table Charitable Trust,17359.0,10892.0
47048,Ifton Miners' Welfare Institute and Recreation Ground,17347.0,14220.0
116811,Centre for Recent Drawing,17347.0,15837.0
15424,The Rotary Club of St Leonards-on-Sea Samaritan Fund,17346.0,13337.0
121708,Sherborne Festival Chorus,17345.0,14990.0
81284,Rotary Club of Droitwich Spa Charitable Trust,17345.0,11660.0
102584,South West Airfields Heritage Ltd,17342.0,17356.0
119562,Werewolves of London Special Ice Hockey Club,17338.0,17851.0
66979,Rotary Club of Kidsgrove Trust Fund,17338.0,17066.0
43052,Shropshire Family History Society,17338.0,19240.0
124095,The Rotary Club of Portishead Trust Fund,17328.0,17534.0
95443,St Briavels Music Society,17328.0,15491.0
42853,Rutland Musical Theatre,17309.0,17996.0
63327,Rotary Club of Bathavon Trust Fund,17305.0,18599.0
28380,The Bookplate Society,17301.0,13272.0
131947,Song in the City Charity Trust,17289.0,13531.0
64525,Molehurst Womens Club,17287.0,14493.0
102240,Southampton Festival of Music and Drama,17286.0,18004.0
72910,British Czech and Slovak Association,17283.0,20480.0
71858,Rotary Club of Knutsford Trust Fund,17280.0,19875.0
39189,Penrhiwceiber Recreation Ground Scheme,17271.0,1874.0
98102,Rotary Club of Peterborough Minster Trust Fund,17253.0,20791.0
76417,Sevenoaks Symphony Orchestra,17253.0,19848.0
53951,Chester in Concert,17252.0,19342.0
