,name,income,expend
30165,Friends of Epping Forest,13452.0,13675.0
5043,The Edith Bankes Memorial Institute,13445.0,15213.0
39657,Dunvant Unemployed and Social Centre,13439.0,12961.0
42148,Hattersley Community Association,13428.0,11982.0
98849,Ditton Heritage Centre Limited,13424.0,36162.0
44367,Bradwell War Memorial Hall,13424.0,13862.0
105660,Mildenhall Road Estate Community Association,13414.0,12933.0
96230,Caister Youth and Community Centre,13404.0,9744.0
6319,The Broadheath Memorial Hall,13398.0,17672.0
20294,The Western Community Centre,13395.0,12312.0
121703,Canolfan Awelon,13371.0,12495.0
117898,Seeds for Development,13366.0,297.0
22893,St Edmund Hall Association,13353.0,11158.0
94175,The Gloucestershire Group of the Rospa Advanced Drivers and Riders,13342.0,12411.0
133722,Development in Action,13339.0,10271.0
92624,Madeley and District Community Association,13336.0,14821.0
7749,Women's Institute - Rochford,13303.0,14478.0
7814,Women's Institute - Moreton-in-Marsh,13299.0,11644.0
65804,Coychurch Women's Institute,13295.0,12816.0
59226,Gwernymynydd Village Centre,13281.0,10427.0
46751,Fairways Community Centre,13280.0,11576.0
92502,Great Yeldham Reading Room,13267.0,14512.0
51334,St Andrew's (Sutton Park) Community Association,13248.0,14376.0
102186,Cefn Fforest Community Centre Management Committee,13244.0,13568.0
8002,Knowle Institute,13228.0,10703.0
92933,Aylsham Youth and Community Centre,13208.0,10232.0
86883,Charity of Martha Sophia Webb,13203.0,10551.0
62885,King's Cliffe Memorial Hall,13203.0,10885.0
47400,Bournheath Village Community Centre,13202.0,7669.0
51663,Anne Peirson Charitable Trust,13198.0,18064.0
7613,Seasalter and District Women's Institute,13192.0,6790.0
24090,Abberton and Langenhoe Community Association,13191.0,10012.0
45378,Canolfan Cymdeithasol Capel Iwan A'r Cylch (Capel Iwan and District Community Centre),13184.0,10847.0
5807,Skipton St Thomas Charity,13176.0,3280.0
104771,Tees Valley Chinese Community Centre Ltd,13151.0,31885.0
6083,Overton and District Memorial Hall,13139.0,12684.0
7622,Women's Institute - Lowgate,13126.0,12753.0
24203,The Nursling and Rownhams Community Association,13126.0,14110.0
101236,Wings of Hope Community Association,13124.0,12389.0
20644,Emneth Central Hall Management Committee,13121.0,14886.0
42797,Wadsworth Community Association,13121.0,13526.0
9819,Sutton in Craven Community Centre,13120.0,12131.0
19040,Hurst Green (Surrey) Community Association,13107.0,24410.0
125590,Learning & Development Centre Limited,13096.0,13265.0
43028,Orchard Park Recreation and Community Association,13089.0,13654.0
78267,Christopher Centre Community Association,13073.0,11032.0
25159,Ford Youth and Community Centre,13071.0,13767.0
119852,Engineering Timelines,13052.0,8977.0
48575,Plawsworth and Kimblesworth Community Centre and Recreation Ground,13038.0,17361.0
38456,The Clarborough and District Community Association,13011.0,7798.0
32084,Northborough Community Association,13010.0,13597.0
90978,The Parish Hall of St James Bristol,13000.0,12.0
33530,Capel Village Memorial Hall,12995.0,11090.0
107157,Boston Community Transport,12993.0,7141.0
30807,King George V Memorial Hall,12971.0,17964.0
80609,Brixworth Centre Management Committee,12954.0,11840.0
7962,Women's Institute - Pennington,12951.0,13828.0
59045,Crosscrake Women's Institute,12933.0,11301.0
17854,Weybourne Community Association,12923.0,8008.0
43549,Didsbury Community Association,12914.0,7699.0
8130,Women's Institute - Curdworth,12909.0,10355.0
127921,Ashrafia Centre and Ghausia Trust,12908.0,9475.0
16210,Beare Green Community Association,12897.0,11509.0
26003,Norwich Community Workshop,12890.0,1770.0
50849,Hawksworth Community Association,12887.0,2897.0
135299,Emmaus Leadership,12887.0,8084.0
20133,Whipton Community Association,12878.0,9444.0
22187,Shepherdswell Women's Institute,12874.0,13138.0
30492,Longstanton Village Institute,12844.0,11965.0
