,name,income,expend
29784,"The Academy of St Mary's, Wimbledon",15628.0,16700.0
125521,Oases Trust,15627.0,13469.0
64853,Rotary Club of Stokesley Trust Fund,15616.0,12957.0
64137,Rotary Club of Waterlooville Trust Fund,15615.0,11553.0
132647,Positive Cycle Trust,15612.0,16958.0
55176,Veerashaiva Samaja of United Kingdom,15608.0,14711.0
96660,The Rotary Club of Melcombe Regis Charitable Trust,15604.0,13796.0
40079,Cor Meibion Glyn Nedd (Glynneath Male Choir),15601.0,18251.0
25600,The Lymington Choral Society,15600.0,14600.0
88816,The Titchfield Recreation Ground,15591.0,15591.0
101830,East End Shed,15589.0,18106.0
51182,Bestwood Male Voice Choir,15586.0,12822.0
119272,F C Rangers J.F.C,15583.0,13016.0
50772,The Lytham Heritage Group,15579.0,20019.0
44848,Macclesfield and District Lions Club Charity Trust Fund,15575.0,12989.0
18723,London Medical Orchestra,15574.0,16366.0
33408,Sutton Recreation Ground and Memorial Hall Trust,15573.0,18155.0
113683,Sutton Valence Choral Society,15552.0,15821.0
123052,Chess Valley Barbershop Singers,15552.0,12360.0
12670,Colne Dramatic Society,15552.0,13071.0
57513,Sheffield Philharmonic Orchestra,15552.0,17969.0
73483,Tunbridge Wells Rotary Club Trust,15551.0,10121.0
136606,Friends of Barnes Common,15548.0,18375.0
122678,Derby Concert Orchestra,15547.0,13819.0
22019,Westonzoyland Engine Trust,15542.0,17786.0
45317,Avenger Performing Arts,15542.0,14406.0
32825,Poringland Welcome Home and Memorial Playing Fields,15532.0,11650.0
71150,Rotary Club of Sandwich Trust Fund,15530.0,15530.0
42910,The Llantilio Crossenny Festival of Music and Drama Limited,15529.0,15579.0
71118,St Margaret's Cemetery,15525.0,15525.0
33548,"King George's Field, Dunsfold",15523.0,14826.0
83196,The Rotary Club of Coventry Breakfast Charitable Trust,15521.0,14497.0
125626,Wolverhampton Judo Club,15510.0,12671.0
62309,Rotary Club of Norwich St Edmund Charitable Trust Fund,15503.0,13023.0
134203,Chichester Players,15496.0,8737.0
63497,Steyning Music Society,15488.0,12317.0
96815,Fulham Symphony Orchestral Society,15487.0,18068.0
68086,Carillon,15486.0,14559.0
123367,National Association for the Teaching of Drama,15485.0,14347.0
16211,Rotary Club of Newport Pagnell Trust Fund,15466.0,15237.0
40004,Elvington United Sports Club,15465.0,20230.0
13553,Hexham and District Music Society,15464.0,15658.0
62642,Rotary Club of Rhondda Trust Fund,15458.0,11188.0
38593,Durham County Schools Athletic Association,15455.0,15736.0
126632,Transporttheatre.eu Ltd,15455.0,35083.0
14983,Pateley Bridge Dramatic Society,15452.0,18663.0
77660,Rotary Club of Towcester Charitable Trust Fund,15445.0,10034.0
27303,The Farrant Singers,15440.0,15100.0
61634,Cumbrian Railways Association,15439.0,16415.0
87867,Rotary Club of Church and Oswaldtwistle Trust Fund,15437.0,11843.0
65058,Rotary Club of Woodhall Spa Trust Fund,15436.0,14519.0
41158,Stone Choral Society,15431.0,14187.0
103315,The Herculaneum Society,15428.0,10428.0
115760,Livestock,15425.0,12580.0
81466,Sutton-Under-Whitestoncliffe Village Institute,15421.0,22066.0
43403,Sandwell Special Olympics Association,15418.0,14035.0
54737,Taunton Sinfonietta,15418.0,14956.0
118291,The Rotary Club of Ashbourne Trust Fund,15413.0,12061.0
94566,The Romsey Singers,15411.0,16823.0
20424,St Albans Musical Museum Society,15404.0,36708.0
44128,The Heckmondwike Players,15402.0,13741.0
94957,Essex Mason Trust,15401.0,14600.0
17560,The Northamptonshire Ironstone Railway Trust Limited,15399.0,15963.0
72512,Fownhope Recreation Field Association,15395.0,14390.0
68612,"The Chichester Festival for Music, Dance and Speech Festival Association",15394.0,14987.0
50208,The Friends of the East Riding Youth Orchestras,15391.0,11445.0
40313,The Lions Club of Rutland Charity Trust Fund,15385.0,11658.0
104489,The Orchestra of the City,15383.0,17581.0
27200,Glastonbury and Street Lions Club Trust Fund,15383.0,15083.0
59245,Rotary Club of Buckingham Trust Fund,15376.0,16098.0
24485,Bedford Park,15371.0,26984.0
98972,The Tavistock Museum Charitable Trust,15370.0,14270.0
63391,Rotary Club of Holyhead Trust Fund,15370.0,3520.0
41247,The St Asaph Choral Society,15361.0,12577.0
71301,Rotary Club of Ilminster Trust Fund,15352.0,15826.0
40511,Stamford Choral Society,15350.0,14919.0
133489,Richard Jefferies Museum Trust,15350.0,0.0
40374,Liverpool Metropolitan Cathedral Concerts Society,15350.0,15262.0
13620,The Wiltshire Historic Buildings Trust Limited,15349.0,10881.0
2748,Purcell Society Trust,15344.0,13972.0
111441,Camel Estuary Youth Sailing,15344.0,16489.0
128710,Bristol Concert Wind Band,15339.0,14384.0
65133,Lemington Male Voice Choir,15336.0,17313.0
50579,Prestbury (ST Peter's) Choral Society,15326.0,14726.0
103182,Rotary Club of Whiteley Charitable Trust Fund,15315.0,10987.0
17531,The Bedfordshire Natural History Society,15315.0,7393.0
19149,The Heathfield Silver Band,15311.0,10221.0
79040,Dunstable and District Round Table Number 400,15302.0,14144.0
41957,The Friends of St Alphege Music,15299.0,7127.0
54248,Little League Football,15297.0,18773.0
64114,The Rotary Club of Kelvedon and District Charity Trust Fund,15296.0,10552.0
57860,Thurrock Arts Council,15291.0,19268.0
43892,Rotary Club of Poulton-Le-Fylde Trust Fund,15291.0,11370.0
51902,Friends of the Fan Museum,15290.0,12291.0
56544,Surrey Festival Choir,15283.0,16974.0
40300,Freiston Playing Field Charity,15283.0,14328.0
35488,The Albert Museum and Art Gallery,15281.0,16581.0
52748,David Willcocks Music Trust,15278.0,14600.0
131886,Devonport Field Gun Association Ltd,15266.0,14549.0
71529,Rotary Club of Brighton and Hove Breakfast,15264.0,12740.0
126996,Jutp Music,15264.0,13353.0
64314,Rotary Club of Harrogate Trust Fund,15264.0,17021.0
29397,Thorney Society,15260.0,6333.0
23926,Royal Manor Theatre Company,15260.0,10337.0
44429,Steeton Male Voice Choir,15257.0,12909.0
66030,Rotary Club of Fordingbridge Charity Trust Fund,15257.0,16470.0
132414,The Rare Trust,15254.0,13687.0
40429,The Rotary Club of Coventry Charity Fund,15253.0,18942.0
122784,Ensemble,15252.0,16604.0
114661,The Roseland Festival Association,15249.0,18116.0
65772,Rotary Club of Newton Aycliffe Trust Fund,15238.0,14623.0
28540,Regent Brass,15235.0,15484.0
22846,Newton Abbot and District Society of Arts,15234.0,13566.0
82803,Leominster Choral Society,15229.0,11414.0
65051,Rotary Club of Garston Trust Fund,15229.0,18123.0
81321,Fernhurst Choral Society,15227.0,12899.0
122347,Bolton Hoover Brass Band,15227.0,15050.0
130683,The Rhythm Studio Foundation,15222.0,3602.0
26853,Bench Theatre,15222.0,13600.0
90768,Kingston Orpheus Choir,15217.0,17716.0
36227,Exhibition of the History of Legal Robes and Costumes,15217.0,18957.0
60299,Blaenavon Male Voice Choir,15213.0,13229.0
93383,Rotary Club of Holderness,15189.0,13121.0
66047,The Sirenian Singers,15183.0,16652.0
30504,Upwell Playing Field,15181.0,15181.0
87043,Saltburn 53 Drama Group,15179.0,14835.0
58194,Plymouth Proprietary Library,15175.0,21061.0
122229,The Sussex Cricket Museum and Educational Trust,15174.0,20042.0
77265,Berkhamsted Lions Club Charitable Trust,15174.0,16339.0
107920,Rotary Club of Westbourne Trust Fund,15169.0,17760.0
111714,Cor Tabernacl Treforys/Tabernacle Morriston Choir,15165.0,12865.0
63495,Rotary Club of Langport and Somerton Trust Fund,15163.0,12326.0
12526,British Record Society Limited,15162.0,6657.0
43346,Solihull Lions Club Trust Fund,15160.0,29108.0
132259,Kaleidoscope Community Music,15158.0,17191.0
126812,Friends of Papercourt Sailability,15157.0,23375.0
50402,The British Music Society of York,15155.0,19989.0
43003,The Bow Trust (Durham) Limited,15153.0,10174.0
53187,The John Innes Society for Conservation in the John Innes Estate at Merton,15145.0,13233.0
134675,Venus & Cupid Arts Trust,15145.0,8517.0
498,The Silver Jubilee Hall,15139.0,13749.0
39162,South Yorkshire Schools Football Association,15139.0,10728.0
21399,The Felixstowe History and Museum Society,15131.0,9003.0
116566,Oxford Young Steps,15129.0,12390.0
33260,The Lady Smith Memorial,15128.0,14972.0
77198,Rotary Club of Amber Valley,15126.0,14596.0
89486,The Harrow School Cricket Fund,15124.0,19942.0
10134,Llansannan Institute,15122.0,8656.0
54105,Hogarth Singers,15109.0,17250.0
135821,Triad: Towards Regional Integration of Artistic Development,15100.0,24704.0
23296,Hangleton Band,15100.0,7900.0
103609,Talking in Tune,15099.0,17712.0
20148,Kessingland Sports and Social Centre,15099.0,16914.0
126722,Pelly Concert Orchestra,15094.0,14035.0
72422,Pontardulais Town Band,15088.0,16242.0
109041,Loop Dance Company,15087.0,19003.0
118344,Hungate Medieval Art,15066.0,15644.0
51090,Gilmorton Community Playing Field Association,15062.0,9339.0
69493,Knaresborough Rotary Club Charity Account,15049.0,12695.0
97875,Larkspur Rovers Football Club,15045.0,12762.0
100709,Dulwich Symphony Orchestra,15045.0,13778.0
54899,The Uphill Village Victory Hall Fund,15042.0,9803.0
23709,Highbridge Festival of the Arts,15031.0,10999.0
118098,Navalar Tamil School,15030.0,15542.0
48066,Penyfford and Penymynydd War Memorial Institute,15026.0,14215.0
54690,East Grinstead Operatic Society (Egos),15020.0,12540.0
92674,Rotary Club of Accrington Trust Fund,15017.0,15010.0
16574,Aylesbury Vale Arts Council,15017.0,30321.0
137681,London Disability Swimming Club,15015.0,3603.0
24578,Bromley (Kent) Festival of Music and Speech,15013.0,14520.0
21616,Tunbridge Wells International Young Concert Artists Competition,15012.0,2056.0
17840,The Sudbury Choral Society,15010.0,17229.0
134501,Friends of Abbey Gardens,15008.0,13327.0
73287,Airshaft Trust,15002.0,12088.0
88974,Brooksbury Recreation Ground,15001.0,15728.0
86176,"Kala, the Arts",15001.0,19289.0
69815,European Jewish Publication Society,15000.0,15200.0
23408,The Farnham Society,14994.0,15426.0
133454,Kennet Amateur Theatrical Society,14992.0,10838.0
44318,The Birmingham School of Music Centenary Appeal Fund,14992.0,10912.0
30102,Biggleswade and District Choral Society,14990.0,13929.0
63521,Black Mountains Lions Club Charity Trust Fund,14989.0,17328.0
120024,Festival Players - Bollington,14988.0,12320.0
80606,Valley End Institute,14984.0,13071.0
131170,The Homeless Film Festival,14977.0,14977.0
88909,Centre of Pendeen,14972.0,37470.0
92237,Rotary Club of Winsford and Middlewich,14969.0,13493.0
128027,UK Friends of Abraham's Path,14961.0,16587.0
53338,The Minehead and West Somerset Arts Society (1989),14959.0,16305.0
50612,Yr Ymddiriedolaeth Ddarlledu Gymreig (The Welsh Broadcasting Trust),14958.0,25911.0
67809,Thames Valley Ancient Egypt Society,14952.0,6106.0
93507,The York Shakespeare Project,14951.0,16763.0
29347,Shanklin Rifle and Pistol Club,14944.0,8369.0
128205,Lapworth Scarecrow Festival,14940.0,5825.0
85802,Agudze Dance Ensemble,14939.0,11766.0
92730,Tall Ships (Wales) Trust,14939.0,18541.0
53032,Eastbourne Gilbert and Sullivan Society,14939.0,20648.0
103998,Rotary Club of Sleaford Kesteven Trust Fund,14937.0,20445.0
9355,Ecclesiastical Music Trust,14937.0,17877.0
26393,Huntingdonshire Local History Society,14935.0,12099.0
64434,Rotary Club of Newport Uskmouth Trust Fund,14935.0,16666.0
29109,Romney Marsh Wartime Collection,14934.0,13954.0
121848,Banbury Choral Society,14930.0,15026.0
26917,Friends of Medway Towns Music Centre,14926.0,13443.0
74235,Vacation Chamber Orchestras,14925.0,18745.0
56964,Harrogate Arts and Mercer Gallery Development Trust,14923.0,8852.0
16678,Swalecliffe and District Rifle Club,14919.0,14919.0
129776,Thames Vale Youth Orchestra Trust,14915.0,13381.0
101838,Eynsham Choral Society,14914.0,16718.0
68761,The Rotary Club of Kirkham and Rural Fylde,14913.0,5524.0
32147,Elvington Recreation Ground,14911.0,14911.0
54240,Arun Youth Aqua Centre,14905.0,18671.0
25011,Burnham Overy Harbour Trust,14903.0,10321.0
102700,Julian Light Operatic Society,14901.0,19427.0
93179,Beare Green and Newdigate Choral Society,14899.0,14678.0
68990,Rotary Club of Matlock Trust Fund,14891.0,12300.0
124343,David Shepherd Cricket Trust,14885.0,9786.0
24995,Hunstanton Lions Club Charity Trust Fund,14884.0,11735.0
113951,Rotary Club of Minster on Sea Trust Fund,14883.0,14621.0
108189,Syston Arts and Recreation in the Community (Saric),14876.0,13340.0
96351,Uttoxeter Choral Society,14867.0,15040.0
58700,Association of Small Historic Towns and Villages of the United Kingdom,14859.0,53987.0
103736,Repton Casuals Football Club,14858.0,16667.0
68472,Shelton Swimming for Therapy Club,14855.0,5871.0
56866,The 1664 Club (Friends of the Royal Marines Museum),14850.0,27788.0
115400,Nantgarw China Works Trust,14836.0,14225.0
47149,Pattingham Playing Fields,14836.0,14404.0
31938,The St Margaretsbury Recreation Ground,14834.0,15865.0
22533,Cheltenham Music Festival Society,14831.0,15772.0
96980,Lavenham Sinfonia,14826.0,16665.0
72936,The Rotary Club of Arundel,14818.0,11514.0
50637,Cantores Olicanae,14817.0,14982.0
28688,The Pastel Society Limited,14816.0,22692.0
117119,Bournemouth Sinfonietta Choir,14808.0,16658.0
62190,Charren Womens Club,14802.0,11625.0
64456,Rotary Club of Redruth Charitable Trust Fund,14801.0,10908.0
128065,Portland Gig Rowing Club,14796.0,10209.0
54200,Rotary Club of Maidenhead Thames Trust Fund,14795.0,20000.0
95684,Holyhead and District Round Table No 1032,14793.0,13762.0
24401,The Richmond Society,14790.0,9452.0
118068,Symphonic Wind Orchestra of North London,14784.0,14507.0
123384,"Viewfinder Photography Gallery Ltd (""Viewfinder"")",14771.0,15892.0
23975,Southend Festival Chorus,14767.0,15824.0
23304,Northampton Festival of Dance,14766.0,15040.0
40410,Lytham St Annes Choral Society,14761.0,16622.0
48102,Grovesend Miners Welfare Scheme,14755.0,8412.0
132746,Midland Find Arts and Language Academy,14753.0,15167.0
123582,Hawkinge Community Football and Sports Trust,14747.0,13391.0
42608,Ripon Museum Trust,14744.0,12.0
97008,The Hexham Round Table Charitable Trust Fund,14744.0,18487.0
98903,Deben Decorative and Fine Arts Society,14742.0,13465.0
32953,Long Buckby Children's Recreation Ground,14735.0,11950.0
59623,Gransdens Sportsfield and Recreational Association,14732.0,10843.0
76027,Tenterden Lions Club Charitable Trust Fund,14731.0,16267.0
53054,The Haverettes All Girls Marching Brass Band,14729.0,14786.0
131169,Swindon Inter-Active Arts Service,14726.0,12795.0
105724,The Lower Darwen Memorial Bowling Association,14722.0,12901.0
119964,Shropshire Charity Concerts,14720.0,14653.0
61073,Ashby Hastings Rotary Club Trust Fund,14711.0,14616.0
63957,Rotary Club of Sandown (I.w.) Charity Trust,14710.0,11626.0
75982,The Rotary Club of Richmond North Yorkshire,14705.0,13359.0
20548,The Stanmore Choral Society,14701.0,16681.0
40768,Middlesbrough Teesside Lions Club Charity Trust Fund,14701.0,16018.0
61358,Bruvvers Theatre Company,14700.0,6013.0
132504,Leicestershire Co-Op (Snibston) Band,14693.0,16789.0
23314,The Medway Towns Band,14691.0,17747.0
119202,Ibis Junior Football Club,14690.0,14438.0
108291,The North Norfolk Rotary Club Trust Fund,14688.0,15856.0
65175,The Eastwood Chorale,14666.0,14982.0
130340,Endelienta,14664.0,6703.0
63341,Rotary Club of Highcliffe-on-Sea Trust Fund,14654.0,15694.0
26117,Rotary Club of Bristol Trust Fund,14654.0,13916.0
23454,North London Symphony Orchestra,14651.0,17472.0
80494,Grosvenor Light Opera Company,14649.0,20739.0
72413,Genesis Chorale,14645.0,14425.0
95020,Hebden Bridge Saints Junior Association Football Club,14644.0,14145.0
28787,Swanley and North Downs Lions Club,14643.0,13755.0
98177,Epsom Male Voice Choir,14642.0,15435.0
133812,Stacey Amateur Boxing Club,14637.0,6289.0
133965,The Midland Railway Society,14630.0,11630.0
28750,Passe-Partout,14623.0,13603.0
40866,The Cardiff Male Choir,14621.0,13284.0
90444,Rugby Gateway Club,14621.0,15757.0
100758,Martlesham Brass,14614.0,8865.0
72516,Burgess Hill Symphony Orchestra,14612.0,13676.0
93535,Whitehall Orchestra,14608.0,18114.0
17697,Wolverton  Gilbert and Sullivan Society,14597.0,15919.0
100721,Rotary Club of Beccles Charitable Trust,14597.0,13124.0
16905,Rotary Club of Stowmarket Trust Fund,14593.0,19078.0
55696,Shape Bucks Limited,14589.0,14664.0
35145,Greening Lamborn Trust,14588.0,21412.0
94282,East Sussex Community Trust,14587.0,16218.0
66009,Somerset Singers,14584.0,11016.0
47276,Dordon Miners Welfare Institute,14580.0,10604.0
22548,The West Suffolk Decorative and Fine Art Society,14579.0,13051.0
131903,Malton Dodger Limited,14575.0,10163.0
34466,The Budleigh Salterton Arts Centre and Museum,14575.0,17599.0
56057,West Selby Miner's Welfare Scheme,14572.0,18775.0
102560,Kington Choral Society,14567.0,13051.0
113449,Chard Entertainment Society,14558.0,15633.0
129134,The Little Zoo,14556.0,21965.0
67249,Rotary Club of Dunstable Trust Fund,14554.0,16782.0
65044,Rotary Club of Meriden Charity Trust Fund,14550.0,12259.0
80210,The Scarborough Music Centre E.A.S.Y. Bands Parents Support Group,14550.0,15623.0
15050,Glossop Choral Society Ltd,14539.0,11643.0
125509,Lofthouse 2000 Brass Band,14532.0,12242.0
20611,Friends of the Geffrye Museum,14526.0,15102.0
68083,Friends of Bushey Museum,14523.0,14739.0
43077,The Sir Anthony Wharton Rugby Union Football Trust,14522.0,4535.0
133412,Otley Museum and Archive Trust,14521.0,7125.0
23699,The Chiltern Choir,14520.0,14397.0
85968,Maescar Community Hall Committee,14511.0,11225.0
109749,Rotary Club of Brigg Trust Fund,14509.0,18208.0
53510,The Rotary Club of Bradford on Avon Trust Fund,14507.0,16669.0
123801,Inside Out Community Arts in Mental Health,14500.0,17145.0
100752,Vocal Expressions,14496.0,14206.0
64334,Rotary Club of Langley and Iver Trust Fund,14494.0,17566.0
78685,Westbury Lions Club Charitable Trust,14485.0,16921.0
87808,Rotary Club of Godalming Woolsack Charity Trust Fund,14482.0,18727.0
21564,Fakenham Choral Society,14480.0,16948.0
94667,Algerian British Connection (Abc),14480.0,10346.0
1743,The Rotary Club of Birmingham Charitable Fund,14477.0,16864.0
67133,Bournemouth Chamber Music Society,14476.0,17003.0
25779,Rotary Club of Fareham Charitable Trust,14475.0,8344.0
80500,Bude Town Band,14474.0,7776.0
111648,Prestwich Ahavas Chesed,14474.0,8000.0
49966,Halifax Philharmonic Club,14467.0,20269.0
89627,Sandbach Voices,14448.0,13780.0
112577,Thomas William Varley Roe Deceased,14444.0,49484.0
43850,Montgomeryshire Youth Theatre,14435.0,14333.0
54502,Rottingdean and Saltdean Lions Club Charitable Trust Fund,14428.0,15271.0
23490,Friends of the Braintree District Museum and Heritage Trust,14426.0,15490.0
20329,Guilsborough Playing Field Association,14418.0,11448.0
25858,The Tonbridge Decorative and Fine Arts Society,14418.0,14023.0
123681,Malcolm Arnold Festival,14414.0,8585.0
110272,The Beaminster Singers,14410.0,11384.0
29931,Teddington Choral Society,14407.0,14799.0
63960,Rotary Club of Southampton East,14404.0,13846.0
131628,British Gurkha Ex-Servicemen's Community [Bgesc],14400.0,8583.0
108866,The Fidelio Charitable Trust,14395.0,121217.0
131901,Great Grimsby Ice Factory Trust,14390.0,17695.0
47189,Scot Hay Social Centre and Recreation Ground,14383.0,11808.0
106909,Blackheath & Bramley Choral Society,14380.0,14611.0
38287,Rotary Club of Huddersfield Trust Fund,14374.0,10808.0
23158,Radlett Light Opera Society,14373.0,8419.0
39315,Whitland Town Hall,14372.0,11317.0
51559,The Clayton Playing Fields,14372.0,31600.0
39339,The Micklegate Singers,14365.0,14062.0
80010,Catholic National Library,14358.0,10888.0
32395,Leyton Sports Ground,14350.0,14350.0
134799,Nottingham Alevi Cultural Centre,14349.0,20789.0
38307,The Wrexham Musical Theatre Society,14348.0,19541.0
18519,Ashwell Village Museum,14344.0,10029.0
116763,Ardingly Choral Society,14336.0,15553.0
117079,Friends of Sheffield Manor Lodge,14335.0,13014.0
81594,The Solti Foundation,14328.0,5865.0
76595,Pitney Recreation Ground Trust,14324.0,11662.0
58566,Blaenavon Town Band,14323.0,13304.0
65689,The Rotary Club of Reigate Rotary Service Fund,14321.0,18338.0
116113,Almondsbury Youth Football Club,14312.0,14261.0
18209,The Loughton Amateur Dramatic Society,14311.0,12244.0
54986,The Beatrice Lillie International College of Comedy and Musical Theatre,14311.0,11198.0
47760,Green Hammerton Recreational Charity,14309.0,9545.0
131435,Common Ground (New Forest) Trust,14306.0,12448.0
59115,Coopersale Social Institute,14302.0,18047.0
56082,Rye and District Lions Club Charity Trust Fund,14293.0,13001.0
15741,Waterside Musical Society,14292.0,17292.0
104981,Diss Decorative and Fine Arts Society,14292.0,13594.0
22307,Folkestone and Hythe Orchestral Society,14291.0,11571.0
114679,Eype Centre for the Arts,14290.0,12021.0
112443,Catalans UK,14288.0,15581.0
125608,Gmax Trackstars Athletics Club,14283.0,14951.0
66619,Rotary Club of Gillingham (Dorset) Trust Fund,14274.0,12335.0
69691,Rotary Club of Redbridge Charitable Fund,14267.0,11704.0
26284,Luton Choral Society,14262.0,16398.0
93082,Earl Marshal Recreation Ground,14262.0,13549.0
22174,Keswick Hall Choir,14261.0,12461.0
28550,Amici Chamber Choir,14257.0,15079.0
45775,Strines Recreation Ground,14254.0,12765.0
20662,Selsey Amateur Choral and Operatic Society,14252.0,13606.0
86974,The Midsomer Norton and District Carnival Charity Association,14252.0,18158.0
126696,Ashbourne Singers,14249.0,12427.0
86078,Etchingham Trust for Sports and Recreation,14245.0,12153.0
19725,Friends of Merton's Young Musicians,14244.0,12644.0
76017,The Royal Tunbridge Wells Round Table Charitable Trust,14244.0,21367.0
107875,Llandudno Musical Productions,14238.0,19841.0
98022,The Martyn Donaldson Music Trust,14235.0,10255.0
94340,The Gower Chorale,14234.0,12407.0
77892,Chilcompton Sports,14232.0,12639.0
106653,Hartlepool Footlight Youth Theatre,14227.0,16810.0
121700,"Goring, Woodcote & District Lions Club Charitable Trust Fund",14225.0,11005.0
16608,South Barrow Recreation Trust,14222.0,10767.0
121115,Suffolk Sinfonia,14219.0,11830.0
33672,The Basil Ionides Memorial Centre,14213.0,7822.0
11105,Langley Public Institute,14200.0,8150.0
132871,Coleridge Memorial Trust,14200.0,30511.0
25202,Maidenhead Music Society,14199.0,17205.0
128420,Oakham Festival,14188.0,14803.0
21529,King's Own Yorkshire Light Infantry Regimental Museum,14182.0,11476.0
21022,The Friends of Rye Art Gallery,14181.0,11974.0
8498,Harry Mitchell Park,14177.0,14177.0
76448,Great Dunmow Maltings Preservation Trust Limited,14175.0,18568.0
74790,Frodsham and District Round Table Charitable Trust,14169.0,8907.0
56712,Bournville Children's Choir,14167.0,9144.0
58986,Pontesbury Public Hall,14161.0,11700.0
69073,Sussex Symphony Orchestra,14160.0,10887.0
70522,Colchester and North East Essex Building Preservation Trust,14152.0,15805.0
47453,Broadwell Park,14149.0,14149.0
71998,Knaphill and St John's Operatic Group,14140.0,15955.0
25127,Wootton Park Association,14133.0,16598.0
88870,Saltburn Artists Projects Ltd,14127.0,14845.0
87030,Durham Cathedral Choir Association,14127.0,21126.0
122941,Wiveliscombe and District Rotary Club Charitable Trust Fund,14126.0,23759.0
50584,Swanland Playing Field Association,14123.0,8117.0
132850,Artbox London,14108.0,17796.0
94886,East Malling Singers,14107.0,11700.0
14867,Cymdeithas Cor Meibion Myrddin,14102.0,14102.0
79610,Ahavath Chesed,14102.0,16300.0
43822,Mexborough Lions Club Charity Trust Fund,14096.0,14371.0
21868,Butleigh Playing Fields Association,14086.0,13527.0
59815,Friends of Yorkshire Sculpture Park,14086.0,29478.0
129960,Sikh Sport UK,14085.0,9587.0
127987,Shanty Theatre Company Ltd,14084.0,13955.0
11827,The Rotary Club of Hexham Charity Fund,14084.0,15959.0
47497,The Woodcock Memorial Field,14082.0,6034.0
17393,"King George's Field, Caister - on - Sea",14080.0,13922.0
60731,Ribchester Festival of Music and Art Limited,14075.0,12477.0
77587,Hyde Band,14069.0,13365.0
18920,The Shaftesbury Town Silver Band,14063.0,11577.0
120897,Royal Marines Band Fund Plymouth,14059.0,19554.0
123748,Bradwell Sports Club,14053.0,14218.0
21259,The Holst Singers,14049.0,20199.0
25023,The South Ockendon Zero Five Club,14034.0,13166.0
42816,The Friends of Shrewsbury Museum and Art Gallery,14034.0,4749.0
132596,The Choral Course Foundation,14031.0,17091.0
107797,Thurrock Bowls Club,14030.0,14169.0
96232,Penguin Collectors Society,14029.0,12933.0
85245,The Friends of Chertsey Museum,14029.0,12394.0
30574,Alice Hext for Recreation Ground,14026.0,9662.0
90250,Music at St Peter's,14025.0,15615.0
68160,Osun Arts Foundation,14020.0,10992.0
103414,Supersports Kidz Club,14012.0,14943.0
123866,Cantorum Choir,14003.0,16033.0
29413,World Tree Arts Trust,14000.0,9196.0
82829,Hopgrove Playing Fields Association,14000.0,13000.0
25512,Brodie-Lodge Playing Field,13998.0,8794.0
43064,"Amgueddfa'r Mor, Porthmadog - Porthmadog Maritime Museum",13997.0,8225.0
41611,Southport Photographic Society,13996.0,13004.0
23024,Crowthorne Choral Society,13992.0,22230.0
107935,Castle Dore Rowing Club,13992.0,13919.0
11592,Wednesfield Rotary Club Charitable Trust Fund,13991.0,9750.0
101819,Wirral Lions Club Charitable Trust Fund,13986.0,11098.0
63899,Rotary Club of Hyde Trust Fund,13978.0,8242.0
38429,The City of Chester Male Voice Choir,13973.0,11956.0
111055,Staxton Singers,13963.0,9605.0
40357,Coxwold Playing Field Association,13956.0,21564.0
51425,Quarry Bank Musical Theatre Society,13951.0,13673.0
52880,Eridge Trust,13950.0,35349.0
25257,The Holman-Climax Male Voice Choir,13944.0,23493.0
55964,South West London Choral Society,13943.0,16566.0
108025,Cor Cymysg Dyffryn Conwy,13942.0,11351.0
70405,Henley Youth Festival Trust,13941.0,18157.0
119723,Leytonstone Festival Association,13935.0,17991.0
47542,Walkington Playing Field,13925.0,11462.0
41820,Warwick Corps of Drums,13921.0,16587.0
73555,Rotary Club of Chorley Astley Charity Account,13921.0,12884.0
47514,Village Institute,13918.0,12314.0
19562,Cerberus Spelaeological Society,13916.0,9610.0
66021,Rotary Club of Holsworthy Trust Fund,13915.0,12941.0
89262,Midsomer Norton and Radstock Silver Band,13907.0,11844.0
101419,Sudbury Lions Club Charitable Trust Fund,13902.0,17475.0
5973,Crescent Theatre (New Building) Trust Limited,13900.0,7546.0
66978,Rotary Club of Maghull Trust Fund,13899.0,13341.0
