,name,income,expend
64790,Rotary Club of Morriston Trust Fund,12484.0,9594.0
125447,Redland Wind Band,12480.0,12677.0
124699,Rhythm of Salsa Group,12471.0,12468.0
67889,HHH Concerts,12463.0,13103.0
61625,Rotary Club of Bridport Trust Fund,12463.0,10076.0
57394,Rotary Club of Sutton Nonsuch Trust Fund,12460.0,13260.0
80919,Rotary Club of Westgate and Birchington,12455.0,9155.0
70428,The Ripieno Choir,12455.0,13611.0
66814,Rotary Club of Etwall and Hilton Trust Fund,12453.0,18477.0
31137,Playing Field,12452.0,10853.0
58718,Buxton Festival Fringe,12450.0,12800.0
132944,Bilton and Woodfield Community Library Group,12446.0,6455.0
20706,St John's (Blackheath) War Memorial Association,12440.0,2850.0
135097,The Redbridge Music Lounge,12439.0,11046.0
45777,The North Wingfields Miners' Recreation Ground and Institute,12435.0,16628.0
99713,The Marches Community Choir,12435.0,6868.0
120513,The Leopold Trust,12432.0,18947.0
25906,MK Brass,12431.0,8676.0
115565,O & S Music,12431.0,13121.0
87864,Rotary Club of Keyworth and Ruddington Charity Trust Fund,12415.0,14045.0
74084,Dunswell Village Institute,12415.0,13438.0
55452,The Jaguar Pantomime Society (1991),12412.0,11626.0
34235,The London Youth and Recreational Trust,12409.0,0.0
23274,The Wesley Historical Society,12408.0,9184.0
50018,The Huddersfield Music Society,12406.0,13148.0
57828,Barbara Walton Singers,12400.0,12406.0
101235,Coolshade Community Musical Workshop/Coolshade Community Group,12400.0,4645.0
73257,Devizes Musical Theatre,12396.0,15388.0
125635,Avoncroft Cricket Club,12396.0,13590.0
64761,Southampton Stage Dance Festival,12395.0,12109.0
19987,Folkestone Choral Society,12387.0,17473.0
111010,Plymouth Mayflower Rotary Trust Fund,12384.0,10830.0
40445,Accrington Theatre Group,12379.0,11820.0
72631,Chesham Arts Festival,12377.0,12160.0
101905,Southwell Town Bowls Club,12377.0,16271.0
78559,Friends of Burwell Museum,12375.0,13427.0
120851,Hadley Wood Sports Trust,12375.0,3632.0
23594,West Blatchington Windmill Society,12374.0,5829.0
111453,Nelson Arion Glee Union Male Voice Choir,12365.0,14730.0
119379,North Leverton Windmill Trust,12363.0,11648.0
57781,The Music Hall Guild of Great Britain and America & the Theatre and Film Guild of Great Britain and America,12360.0,5524.0
71389,Rotary Club of Wensleydale Trust Fund,12359.0,10030.0
117415,Adfer Ban a CHWM,12359.0,5860.0
42877,Bishops Castle Public Hall,12359.0,10615.0
42724,The Kidwelly Heritage Centre and Tinplate Museum Trust,12357.0,16942.0
128095,Blackthorn Equestrian Rescue,12356.0,12203.0
37803,Bonnie Bird Choreography Fund,12356.0,25806.0
15207,The Camden History Society,12355.0,10556.0
67497,Rotary Club of Mapperley and Arnold Charitable Trust,12355.0,17634.0
19523,The Chigwellian Choral Society,12353.0,12757.0
69019,Rotary Club of Fleetwood Trust Fund,12353.0,13180.0
120366,Chalford Band,12353.0,16602.0
32955,Memorial Hall and Playing Fields - Middleton Cheney,12346.0,17013.0
91590,London Potters,12345.0,8845.0
46190,Longton Victory Memorial Recreation Ground,12342.0,13429.0
67920,Ruddington and District Choral Society,12338.0,11550.0
98720,The Kendal Windows on Art Trust,12335.0,12186.0
88807,Murray Barford Trust,12334.0,9419.0
70672,Hunstanton and District Festival of Arts,12333.0,18843.0
40523,Cor Meibion Colwyn,12329.0,8806.0
87122,Balsall Common Lions Club Charitable Trust Fund,12328.0,11978.0
63429,Rotary Club of Church Wilne Trust Fund,12326.0,12249.0
118989,Rotary Club of Redcar Trust Fund,12326.0,12781.0
29964,London Titans Wheelchair Basketball Club,12325.0,19349.0
24082,Hertfordshire Family History Society,12319.0,15019.0
42538,North of England Art Club,12318.0,11020.0
124175,The Harsnett Choir,12318.0,10651.0
19311,Radio Redhill,12318.0,11105.0
118241,Deva Boxing Centre,12318.0,18892.0
107329,Market Bosworth Festival Limited,12316.0,14268.0
50306,Holmes Chapel Amateur Operatic and Dramatic Society,12316.0,15094.0
74604,Chelmsford Jazz Club,12312.0,11799.0
73354,The Sinfonia Chorale,12308.0,18560.0
62204,Rotary Club of Crawley Trust Fund,12307.0,9022.0
89068,Friends of Tiffin Music ( Fotm ),12305.0,7956.0
17543,The Trust for Education in Dance and Drama,12302.0,16387.0
87112,Corsley Festival Choir,12300.0,12852.0
20523,Felix Road Adventure Playground Association,12298.0,8706.0
124675,4 Recreation Limited,12296.0,10311.0
127574,Houghton - Le - Spring and District Piping Society,12287.0,11842.0
32729,Bodham Playing Field,12278.0,15488.0
43648,Victoria Theatre (New Theatre) Ltd,12271.0,27178.0
11059,The Edith Mann Charitable Trust,12269.0,11728.0
118985,Wickham Market Youth Football Club,12269.0,14746.0
77435,The Rotary Club of Ripon Rowels Trust Fund,12266.0,12069.0
57281,Scunthorpe and North Lincolnshire Concert Society,12262.0,13522.0
69643,Staffordshire Knights Drum and Bugle Corps,12262.0,12261.0
35968,Westcott Reading Room Trust,12261.0,12738.0
88213,The Rotary Club of Eastbourne Beachy Head,12261.0,9905.0
54577,Association of Friends of Lord Harris Court,12254.0,12126.0
100119,Compass Community Arts,12252.0,10861.0
25451,Newchurch Parish Sports and Community Association,12251.0,26739.0
95373,Lucis Choir,12246.0,10410.0
115182,The City of Oxford Choir,12242.0,10990.0
113926,Shrewsbury Cantata Choir,12238.0,12478.0
51917,Friends of Music in Mayfield,12237.0,5300.0
123496,Bearsted Choral Society,12236.0,9409.0
91134,"Aberhonddu and District Male Choir, Cor Meibion Aberhonddu A'r Cylch",12236.0,13331.0
30202,Elstow Playing Field,12232.0,12354.0
22920,Rotary Club of Shepton Mallet Trust Fund,12231.0,11621.0
60741,Lions Club of Bridport Charity Trust Fund,12228.0,11407.0
126180,Taqwaa Social & Cultural Society,12226.0,4200.0
128521,Slaithwaite Brass Band,12226.0,9872.0
51674,South Devon Choir,12215.0,9253.0
124798,The Betjeman Poetry Prize,12214.0,12336.0
18258,The Australian Musical Foundation in London,12206.0,30674.0
134131,Canterbury Imagine,12204.0,3721.0
67028,Rotary Club of Watford Trust Fund,12200.0,11708.0
112373,Rotary Club of Holbeach Trust Fund,12200.0,9795.0
94787,Escrick Playing Fields Association,12198.0,16273.0
52578,Eastcote Choral Society,12196.0,11447.0
61829,Rotary Club of Morpeth Trust Fund,12195.0,12791.0
94247,Rotary Club of Biggleswade Trust Fund,12193.0,11366.0
121123,Sport Godalming,12192.0,9425.0
51282,Cardiff County and Vale of Glamorgan Youth Brass Band Parents Association,12191.0,25591.0
116608,The London Ballet Circle,12189.0,10329.0
117560,The Adam Gibbons Sports Foundation Fund,12188.0,16512.0
45076,Crosby Festival of Music and Dancing,12186.0,12409.0
35374,The Aldeburgh Museum Collection Trust,12175.0,8593.0
119182,Disability Skiing Wales/Sgio Anabledd Cymru,12173.0,11409.0
118301,Watford Symphony Orchestra,12168.0,11819.0
63289,Friends of Gloucestershire Archives,12165.0,10022.0
119969,Herne Bay Pier Trust,12160.0,20272.0
111079,Caerphilly Male Voice Choir,12159.0,11730.0
135723,Friends of Jesmond Library,12155.0,15506.0
44426,The Port Talbot Cymric Male Choir,12153.0,11199.0
85782,Staffordshire Schools Athletic Association,12135.0,13497.0
123427,Covent Garden Chamber Orchestra,12133.0,10080.0
56542,Friends of Riverhouse,12123.0,7250.0
14755,Strauss Charitable Trust,12123.0,1230.0
40228,Lichfield Round Table Charity Fund,12121.0,15543.0
62305,Rotary Club of Mirfield Trust Fund,12118.0,11056.0
51426,Otley Choral Society,12110.0,10120.0
28377,The Friends of Plymouth City Museums and Art Gallery,12108.0,5975.0
119491,Peter Ucko Archaeological Trust,12104.0,12178.0
102734,The Kilvert Society,12102.0,13846.0
55810,The Rotary Club of Taunton Vale Trust Fund,12099.0,11978.0
101103,City of Truro Male Choir,12094.0,11759.0
40180,The Rotary Club of Clitheroe Trust Fund,12093.0,13068.0
66480,Rotary Club of Havering East Charity Trust Fund,12092.0,10920.0
109335,South Newton and Wishford Recreation Centre,12091.0,9278.0
44958,Darlington Music Society,12087.0,13584.0
73978,Witham Round Table No: 701,12081.0,11821.0
78823,Crosby and District Lions Club Charitable Trust Fund,12079.0,10765.0
107158,Sinfonia Tamesa,12078.0,16937.0
77317,Woodbridge and District Lions Club Charitable Trust Fund,12073.0,8290.0
94551,East London Brass,12072.0,11933.0
96391,Solihull Young Musicians Support Association,12070.0,11712.0
59452,Rotary Club of St Asaph Trust Fund,12068.0,9635.0
52774,Brent Symphony Orchestral Society,12064.0,11176.0
63485,Rotary Club of Locks Heath Trust Fund,12062.0,12112.0
27096,Yardley Gobion Recreation Centre,12057.0,11343.0
65074,Rotary Club of Arbury Charity Trust Fund,12056.0,11845.0
17372,Collegium Musicum of London,12055.0,13169.0
69679,Caos Musical Productions,12049.0,16800.0
56021,Swinton and District Playing Field Association,12049.0,20166.0
52125,Calne Choral Society,12042.0,11607.0
105979,The Exmoor Natural History Society,12039.0,5181.0
130036,Birmingham Gay Symphony Orchestra,12037.0,4644.0
52313,The Richmond Theatre Trust Limited,12036.0,10820.0
62792,Rotary Club of Newton and District Jubilee Trust Fund,12034.0,12157.0
50273,Nidderdale Museum Society,12027.0,11258.0
113808,Northwick Bowling Club,12027.0,11708.0
26634,Finedon Community Sports and Leisure Centre Association,12023.0,10802.0
125483,The Hillplayers,12023.0,12069.0
25590,The North Devon Decorative and Fine Arts Society,12023.0,11858.0
31488,Cheriton Playing Field,12022.0,5481.0
72240,Rotary Club of St Austell Bay Trust Fund,12018.0,14789.0
22283,The Adur Theatre Company,12016.0,13375.0
105472,The Royal Tunbridge Wells Festivals Limited,12015.0,14536.0
43587,Ystradowen Community and Sports Association,12013.0,13399.0
122953,Romsey Male Voice Choir,12010.0,8783.0
54817,Rotary Club of Alford and Mablethorpe Trust Fund,12007.0,12659.0
44034,Association of Friends of the Glynn Vivian Art Gallery (Cymdeithas Cyfeillion Oriel Gelfyddyd Glynn Vivian),12007.0,6981.0
59613,Ibstock Brick Brass,12005.0,10302.0
85338,The Hook Norton Brass Band,12003.0,10387.0
133403,The Musici Trust,12000.0,0.0
132311,Al-Bokhari Education Centre,12000.0,6000.0
94234,Halifax Young Singers Limited,11998.0,11235.0
115881,Amici,11994.0,11237.0
126296,Shalford Choral Society,11993.0,12307.0
58663,Rotary Club of Melton Mowbray Trust Fund,11988.0,15239.0
44274,Llanrwst Chamber Music Society,11985.0,12243.0
121025,Whipton Youth FC,11974.0,10897.0
110246,Spectra Musica,11974.0,12503.0
15261,The Southend Symphony Orchestral Society,11972.0,10952.0
112859,Friends of Corinium Museum,11968.0,23244.0
111768,Combe Down Heritage Society,11967.0,5781.0
124783,Taunton Tigers Basketball Club,11967.0,15606.0
112190,The Long Eaton and District Arts Council Limited,11963.0,6149.0
21334,The Ipswich Chamber Music Society,11961.0,12208.0
108632,Ashby Concert Band,11957.0,4653.0
86720,Gillingham Lions Club Charitable Trust Fund,11940.0,12315.0
24171,Duchy Opera Trust Limited,11938.0,8889.0
22235,Rother Valley Decorative and Fine Arts Society,11936.0,11199.0
77647,Westbury Heritage Society,11935.0,12678.0
61429,Rotary Club of Shaftesbury Trust Fund,11924.0,8324.0
60435,Thurrock Lions Club Charity Trust Fund,11923.0,14667.0
99326,Rotary Club of Basingstoke Loddon Charitable Trust,11920.0,13837.0
18629,Shrewton Recreational Charity,11919.0,14277.0
53602,Channel Arts Association,11919.0,15208.0
65781,Tintwistle Band,11918.0,12554.0
24335,Liverton Copse Community (And Sports) Association,11917.0,12567.0
22072,Lashenden Air Warfare Museum,11916.0,6214.0
110070,The Langley Band,11913.0,11661.0
40902,The Sheffield Chamber Orchestra,11911.0,8790.0
91252,Durweston Choral Society,11899.0,11488.0
33391,Orford Recreation Ground,11892.0,6215.0
112,Brockham Recreation Ground Trust,11889.0,12441.0
24501,The Charitable Fund of the Rotary Club of Havant,11887.0,12332.0
20616,Hounslow Symphony Orchestra,11886.0,11089.0
57506,Oxford Music Festival,11882.0,12220.0
68908,The Rotary Club of Blaby Meridian Trust Fund,11882.0,7232.0
122217,The Concordia Foundation Artists Fund,11877.0,7656.0
65173,Riverside Women's Club,11876.0,8123.0
90932,City of York and District Family History Society,11873.0,11466.0
130578,Aaron West's Goalkeeping Academy,11872.0,10284.0
17141,The North Wiltshire Orchestra,11869.0,6522.0
13353,Arts Council for North Hertfordshire,11865.0,9990.0
28234,Heathfield Choral Society,11860.0,15548.0
60536,Pershore Rotary Club Trust Fund,11849.0,12379.0
121089,Peter Brook Theatre Awards Trust,11848.0,10851.0
27979,St Sebastian's Playing Field Trust,11847.0,4950.0
118890,Beeches Cadets Marching Band,11845.0,11970.0
23313,Budleigh Salterton Male Voice Choir,11843.0,6876.0
136710,Highbury Opera Theatre,11840.0,14478.0
21379,The Bengali Cultural Association,11838.0,11441.0
71727,The Friends of Ealing Junior Music School,11831.0,15229.0
40517,The Huddersfield Singers,11831.0,11071.0
82014,The Windmill Centre (Cornwall) Limited,11821.0,11909.0
127679,Rotary Club of the Conwy Valley Trust Fund,11821.0,11489.0
133084,The Stephen Thompson Foundation,11818.0,787.0
14315,Melbourne Operatic Society,11813.0,13117.0
81582,Thurnby and Bushby Sports and Social Association,11813.0,9571.0
132624,Friends of Shoreham Fort,11812.0,14050.0
102531,Cam Decorative and Fine Arts Society,11810.0,12300.0
69592,Sprotbrough Music Society,11808.0,10990.0
136002,Ellington Colliery Band,11805.0,11036.0
16221,The Rotary Club of Bookham and Horsley Charitable Trust,11803.0,9878.0
65996,The Rotary Club of Broadstairs Trust Fund,11802.0,9164.0
87174,Exeter Chamber Choir,11801.0,12113.0
38209,The Newcastle Players,11796.0,8803.0
39382,City of Newport Male Choir,11792.0,9617.0
63956,Rotary Club of Lowestoft South Trust Fund,11792.0,3226.0
64326,Flitwick Vale Rotary Club Trust Fund,11791.0,11470.0
136257,Stradbroke Courthouse and Library Trust,11788.0,266.0
129063,Priston Festival,11786.0,10599.0
98943,Sylhet Bawl Shangith Ghosti (Sylhet Spiritual Music Group),11784.0,14175.0
44886,The Little Theatre Donnington Society,11781.0,12277.0
76653,Brentford Toy Library,11780.0,11736.0
69479,Tonbridge Dance Festival Association,11761.0,14020.0
89692,"King George V Playing Field, Northleach",11757.0,12724.0
131452,Preston Guild Link,11752.0,1854.0
105452,Dragon Tale Theatre Group,11750.0,13414.0
106906,Ayton Victory Playing Field,11747.0,10149.0
51777,Chipping Norton Local History Society,11746.0,10032.0
67610,Rotary Club of Macclesfield Castle Trust Fund,11744.0,11443.0
59611,Rotary Club of Manningtree Stour Valley Charity Trust Fund,11743.0,11058.0
133743,Overstrand Sports Club,11741.0,10748.0
74626,Tring and District Local History and Museum Society,11736.0,15492.0
30484,Badcock Recreation Ground,11730.0,10516.0
50538,Rotary Club of Sutton Coldfield Vesey Charities Trust Fund,11725.0,15277.0
75125,Colchester Round Table 367,11723.0,7774.0
25953,The William Walton Trust,11719.0,51446.0
67896,Welwyn Garden Concert Club,11719.0,11154.0
72848,Chess Valley Male Voice Choir,11718.0,11818.0
90427,Bourn Sports Club,11717.0,7576.0
25704,Valley Park Radio,11709.0,2119.0
5666,Anglo-Israel Archaeological Society,11709.0,12381.0
26498,Marlin Swimming Club,11706.0,2612.0
62240,The Trust Fund of the Rotary Club of Tooting,11705.0,14781.0
98382,Workington Juniors Football Club,11703.0,10136.0
85887,Trentham Brass Band,11702.0,6664.0
62286,The Chichester City Band,11702.0,5829.0
53501,Rotary Club of Newent Trust Fund,11699.0,15143.0
26279,Burwell Museum Trust Limited,11698.0,11291.0
45985,Horden Recreation Ground,11690.0,133369.0
115066,Friends of the National Waterways Museum at Stoke Bruerne,11685.0,7101.0
15316,Harpenden Helping Hand Association,11678.0,10418.0
52681,Littlehampton Sportsfield,11674.0,19443.0
66621,Rotary Club of Woodstock & Kidlington,11672.0,10786.0
111004,Cardiff Bach Choir,11671.0,10606.0
111899,Northern Regional Brass Band Trust,11670.0,1747.0
85471,Crewkerne Heritage Centre Limited,11668.0,19378.0
77662,Rotary Club of Lowestoft Charitable Trust Fund,11668.0,8090.0
82045,Martlesham Heath Pavilion,11666.0,5056.0
64681,Rotary Club of Helston-Lizard Trust Fund,11663.0,8446.0
125129,Cambridge Cycling Campaign,11656.0,8318.0
38532,Sunderland Empire Theatre Trust Limited,11647.0,11647.0
74245,Skegness Round Table Number 266 Charitable Trust,11647.0,12987.0
56344,Shelfield Male Voice Choir,11641.0,11304.0
103276,Rowhedge Heritage Trust,11638.0,7632.0
42166,Beverley Decorative and Fine Arts Society,11634.0,12266.0
105290,Allendale Sports Club,11633.0,9461.0
69454,Montgomeryshire Youth Music (Cerddorion Ifanc Maldwyn),11632.0,10635.0
34371,The Battle and District Historical Society Museum,11632.0,12810.0
64954,Rotary Club of Formby Trust Fund,11631.0,10356.0
40145,Rotary Club of Long Eaton Charity Trust Fund,11630.0,9167.0
109094,The Hallam Sinfonia,11630.0,9621.0
130826,Tata Steel Cricket Club,11630.0,13677.0
111415,Hertfordshire Philharmonia,11628.0,13778.0
243,The Rotary Holidays for Children Trust,11628.0,11110.0
60770,Worcester Park Womens Club,11627.0,11666.0
93254,Sudbury Symphony Orchestra,11625.0,12637.0
72724,Tylorstown Band - Valley Lines,11624.0,13422.0
23525,Hampstead Chamber Choir,11624.0,11597.0
120223,North Norfolk Chorale Limited,11618.0,12180.0
38195,Shrewsbury Orchestral Society,11616.0,13729.0
4398,The Thomas Edward Clarke Trust,11609.0,8248.0
75030,Molesey Juniors Trust,11605.0,14458.0
122148,The Mbawula Township Choir Project Limited,11602.0,14568.0
54615,Darlington Choral Society,11597.0,11392.0
41167,The Friends of Wolverhampton Art Gallery,11595.0,11783.0
92210,The South West Academy of Fine and Applied Arts,11593.0,15102.0
61649,Rotary Club of Rochford Charity Trust Fund,11590.0,13372.0
100334,Saffron Walden Lions Club Charitable Trust Fund,11589.0,9773.0
103885,Friends of the Newport Ship,11586.0,7195.0
57311,Brighouse Theatre Productions,11584.0,14911.0
28370,Yateley Choral Society,11582.0,14704.0
103330,Develop Youth Through Sports Trust,11580.0,6018.0
32222,Recreation Ground,11579.0,5199.0
111662,Dorset Reading Partners,11570.0,11706.0
127596,Wigginton Bowling Club,11565.0,9064.0
6839,Friends of the Ferens Art Gallery,11564.0,2636.0
73254,Bideford Round Table Charitable Trust,11562.0,10486.0
43878,Friends of Birmingham Schools' Orchestras,11562.0,7765.0
64522,Rotary Club of Porthcawl Charitable Trust,11555.0,11887.0
74400,Weston-Super-Mare Brass,11554.0,9851.0
38742,Trust Property Held in Connection with the Burton-Upon-Stather Playing Fiels Association,11552.0,9833.0
71261,Rotary Club of Liverpool West Derby Trust Fund,11546.0,10535.0
72196,Cheddar Vale Lions Club Charitable Fund,11535.0,15460.0
79519,Rotary Club of High Suffolk Trust Fund,11532.0,18372.0
110767,Ryde Chorus,11528.0,9889.0
78831,Hereward Heat Wheelchair Basketball Club,11528.0,8757.0
58489,Weymouth Choral Society,11527.0,11961.0
15605,The Devon History Society,11526.0,15472.0
132745,The Dream Foundation,11526.0,14543.0
120548,Shepshed Dolphin Swimming Group,11521.0,10440.0
135576,Theatre O Too Limited,11515.0,11500.0
103917,North West Norfolk Decorative and Fine Arts Society,11509.0,12554.0
27773,Bookham Light Operatic Society,11508.0,10726.0
73102,Redditch Round Table Charitable Trust Fund,11506.0,13457.0
48009,The Gate and District Welfare Association,11504.0,3194.0
32135,Crockham Hill War Memorial Playing Field,11500.0,5916.0
40956,The Penrith Singers,11494.0,11897.0
67915,Luton Festival of Dance,11491.0,9144.0
51219,West Riding Omnibus Museum Trust,11488.0,9400.0
5643,The Royce Institute,11486.0,12816.0
106732,The Rotary Club of Barnsley Trust Fund,11484.0,9979.0
50620,Friends of the North Powys Youth Brass Band,11479.0,10280.0
110427,The Quangle Wangle Choir,11473.0,11445.0
21357,Radlett Music Club,11471.0,13900.0
24173,Alexandra Palace Organ Appeal,11465.0,3922.0
3444,Alexander and Margaret Ogilvie Club Charity,11461.0,5017.0
10324,Banbury Symphony Orchestra,11461.0,9865.0
119611,Brighton and Hove City Brass,11457.0,9980.0
76569,The Friends of the Salford Museums' Association,11454.0,13700.0
25020,Cantanti Camerati,11453.0,9712.0
99579,Brierley Hill Amateur Swimming Club,11447.0,10676.0
86101,Rotary Club of Blackpool Charitable Trust,11447.0,12425.0
41227,Lincoln Music and Drama Festival,11447.0,11961.0
66076,Rotary Club of Leytonstone and Woodford Trust Fund,11446.0,10946.0
77291,Basingstoke Ladies Choir,11441.0,13401.0
77220,Amici Dance Theatre Company,11441.0,19189.0
99132,Birmingham St Georges Day Association,11432.0,16047.0
71802,Rotary Club of Barry Charitable Trust,11423.0,6450.0
103981,Southend Wind Orchestra,11421.0,12634.0
87573,Redhill & Reigate Round Table No. 119,11420.0,10733.0
116465,British Antarctic Monument Trust,11416.0,12326.0
107128,Exeter Choral Society,11413.0,10547.0
54731,The Juliet Gomperts Memorial Trust,11409.0,5829.0
76173,Brighton Chamber Choir,11408.0,12278.0
76627,The Knaresborough Choral Society,11403.0,9295.0
73689,The Dugdale Society,11402.0,9947.0
78392,Hucknall Round Table Charitable Trust,11401.0,5519.0
75191,Dover District Lions Club Charitable Trust Fund,11399.0,12698.0
54789,The Halesworth and District Museum,11398.0,9684.0
46054,Hereford Lads' Club,11398.0,11349.0
30332,Shinfield Association,11396.0,11643.0
16438,Sidmouth Concert Society,11396.0,9735.0
107293,Yate & District Heritage Centre Trust,11391.0,10965.0
25266,Thanet Lions Club Charity Trust Fund,11390.0,10990.0
44030,The West Lakeland Orchestral Society,11389.0,9901.0
24059,Wells Recreation Ground,11388.0,14009.0
126716,Community Arts Workshop (Caw) Ltd,11388.0,11376.0
63363,Rotary Club of Crickhowell Trust Fund,11385.0,8491.0
18829,Ipswich Bach Choir,11383.0,10240.0
74231,Orford Museum Trust,11382.0,13360.0
52037,South London Singers,11378.0,11699.0
103447,Reform Club Conservation Charitable Trust,11376.0,158318.0
33232,North Curry Playing Field,11375.0,10394.0
25022,Ember Choral Society,11374.0,12157.0
68754,The Rotary Club of Chesterfield Scarsdale Trust Fund,11374.0,10868.0
24363,Luton Disabled Sports and Social Club,11373.0,8780.0
15664,Norfolk Contemporary Art Society,11370.0,18573.0
45330,Furness Maritime Trust,11369.0,1814.0
82178,City Escape,11363.0,537.0
33335,Copdock and Washbrook Playing Field,11361.0,12095.0
69406,Rotary Club of Hythe Kent Trust Fund,11355.0,14495.0
40940,Cor Meibion Morlais,11354.0,4005.0
130064,Tonbridge Memorial Gardens Trust,11352.0,5367.0
91788,Mid Kent Decorative and Fine Arts Society,11349.0,53989.0
66987,The Hargreaves Narrowboat Trust,11346.0,14313.0
62948,Rotary Club of Tavistock Charitable Trust Fund,11345.0,9544.0
62327,Rotary Club of Ringwood Charity Fund,11342.0,9173.0
109230,Tarantara,11338.0,10779.0
93761,Leamington Sinfonia,11335.0,14528.0
28490,Pyrford Little Theatre,11331.0,11041.0
68174,Rotary Club of Chepstow and District Trust Fund,11331.0,5983.0
32842,Bullock Park,11331.0,4870.0
114396,The Music Makers Choir of Harpenden,11328.0,10820.0
129362,Polish Heritage Society (Uk) Limited,11326.0,19629.0
112635,Manchester Lishi Arts,11324.0,10093.0
135129,Royal Free Music Society Choir,11323.0,13073.0
128530,Manchester Chamber Choir,11319.0,13284.0
68557,Shepton Mallet Collett Park Charity,11316.0,0.0
53079,The Dame Margot Fonteyn Scholarship Fund,11308.0,1512.0
87090,Cashes Green Community Centre,11304.0,13305.0
51749,Friends of the Gloucester Waterways Museum,11299.0,3875.0
127859,Keys of Change,11284.0,13562.0
115179,Stafford Town Football Foundation,11284.0,28300.0
76557,Idee Fixe,11280.0,12645.0
43761,The Swannington Heritage Trust,11276.0,13203.0
57912,The Rotary Club of Greenwich Trust Fund,11274.0,9087.0
102149,Bradford on Avon Arts Association,11273.0,11312.0
43564,Lichfield Lions Club Charity Trust Fund,11271.0,7723.0
128200,Audley Brass Band,11266.0,12322.0
120075,Upbeat Music and Mental Health Limited,11260.0,12003.0
28260,Falmouth Theatre Company,11259.0,14939.0
120435,Sheffield Chorale,11256.0,13232.0
64585,Sevenoaks Three Arts Festival,11249.0,9868.0
17487,South Zeal Recreation Ground,11249.0,16208.0
45045,Ilkeston Brass,11243.0,11371.0
22114,Alison Uttley Literary Property Trust,11243.0,14263.0
75132,Rotary Club of Middlesbrough Erimus Trust Fund,11242.0,14293.0
45306,Rotary Club of Carlisle South Trust Fund,11240.0,10006.0
88125,Burtonwood Heritage,11237.0,13927.0
13645,Cheddleton Flint Mill Industrial Heritage Trust,11236.0,2535.0
39050,Rotary Club of Aberdare Trust Fund,11232.0,10641.0
64877,Brackley Rotary Club Trust Fund,11229.0,5751.0
541,The Victoria Hall,11227.0,7007.0
62955,Rotary Club of Burnley Pendleside Trust Fund,11225.0,15637.0
70995,Oundle Museum Trust,11222.0,13776.0
52486,The Teddington Society,11222.0,10795.0
73188,Trowbridge Symphony Orchestra,11218.0,8886.0
75865,Rotary Club of Strood Charitable Trust,11216.0,12217.0
18169,Atlantic Coast Theatre,11216.0,3603.0
131834,Retro Computer Museum,11203.0,10565.0
39818,Liverpool Round Table No 8 Charitable Trust,11200.0,16740.0
56814,The Parson Woodforde Society,11199.0,14869.0
20511,Music Camp Limited,11198.0,9579.0
27584,Chinnor Silver Band,11196.0,15194.0
80307,The Royal Scottish Country Dance Society - Cheltenham Branch,11195.0,8088.0
45188,The Rotary Club of Shirley Monkspath Trust Fund,11195.0,23687.0
121353,Baluji Music Foundation Limited,11195.0,7196.0
29807,Yateley and District Lions Club Charity Trust Fund,11194.0,7053.0
103837,Fordhouses Health and Fitness Group,11194.0,3822.0
127822,The 617 Squadron Association,11191.0,8160.0
25139,Woking Music Festival,11191.0,11305.0
52071,Basildon Disabled Sports and Social Club,11184.0,8649.0
15431,Axminster Drama Club,11181.0,7085.0
59999,Rotary Club of Llandovery Trust Fund,11180.0,12708.0
65569,The Rotary Club of Barrow-in-Furness Trust Fund,11175.0,10497.0
68199,Market Drayton Rotary Trust,11175.0,11499.0
87269,Friends of Whitcliffe Common,11171.0,9202.0
94956,The Philip Jones Griffiths Foundation,11165.0,10623.0
120965,Launceston Town Band,11162.0,12354.0
71663,Gosforth Round Table Charitable Trust Fund,11161.0,10868.0
67581,The Rotary Club of Holt and District Trust Fund,11161.0,10226.0
92045,The Ottery St Mary Heritage Society,11160.0,3599.0
103232,Walthamstow Pumphouse Museum,11159.0,9963.0
46830,Linby Miners Welfare Recreation Ground,11158.0,10529.0
19665,London Ripieno Society,11155.0,11617.0
